ID,Comment Text,Token Count
853,"Việc hẹn hò với trẻ vị thành niên sớm muộn gì cũng sẽ bị lộ, nên đã dùng vụ kiện 700 triệu won để làm cô bé hiền lành suy sụp tinh thần, đẩy vào chỗ chết.<br>Sae Ron đã bảo vệ mối tình đầu đến cùng và chọn cái chết.<br>Thật đáng thương và đau lòng.<br>Nếu không gặp phải loại người như thế thì đã là một diễn viên tài năng thành công vang dội rồi.<br>Đã phải khổ sở đến mức nào chứ.<br>Kim Soo Hyun đúng là ác quỷ.<br>Còn khoe quà sinh nhật nữa chứ.<br>Sae Ron à, em đã từng rất xinh đẹp và đáng yêu.<br>Em có đang nhìn từ trên trời xuống không?<br>Ở nơi đó đừng đau ốm nữa nhé.",176
854,"Đừng có phóng đại quá mức, hãy xem nội dung cho đúng đi... Không có vụ kiện 700 triệu won nào cả. Đó chỉ là thông báo chứng minh nội dung rằng bạn nợ 700 triệu won thôi... Nếu nói là chết vì mối tình đầu... Vậy chẳng lẽ những người yêu đầu mà gặp phải người không ra gì thì đều phải kiện người yêu đầu hết à?",79
855,Tối nay 7 giờ live nhé.,8
856,"Từ hình tượng ngây ngô thuần khiết tài năng, trong khoảnh khắc biến thành Satan.",18
857,Chắc chắn là sugar dating rồi.,10
858,Câu chuyện nào cũng đầy rẫy sự phản bội... Thật hỗn loạn...,16
859,Tôi đã học được rất nhiều điều. Tuyệt vời.,13
860,Xin đừng để tôi nhìn thấy cái đó trên TV.,11
861,Ối trời ơi Kim Soo Hyun làm thế thật á?? Thật không thể tin được,17
862,Cái này thì chắc chắn rồi. Nhưng mà tự nhiên bảo Won Bin đang yên đang lành phải trừng trị người khác thì cũng hơi hoang mang thật.,31
863,"Tôi là con gái nhưng tôi biết L’inoui. Họ đã tạo ra xu hướng ba lô và nó đã rất thịnh hành vào thời điểm đó. Có một cửa hàng L’inoui ở Lotte Seomyeon. Tôi vẫn nhớ vị trí. Nó ở ngay đối diện thang cuốn, và tôi có một chiếc túi ở nhà Tôi đã trả 700.000 800.000 won. Kwon Sang-woo và Jang Keun-suk đã quảng bá thương hiệu này rất nhiều. Đó là một chiếc ba lô có chất liệu da hơi giống da cá sấu với một túi lớn, và khá nhiều diễn viên nam đã mang nó. Nhưng tại sao tôi lại mua nó nhỉ",134
864,"Không, vị thành niên mà.",8
865,"Tôi thấy tiếc cho Sulli cũng tương tự. Những cô gái mong manh, yếu đuối và không giỏi nghi ngờ người khác, kiểu gì cũng bị những gã đàn ông ranh ma, tính toán giỏi phát hiện ra và bám lấy. Sulli hay Kim Sae Ron cũng vậy, chẳng những không được những gã đàn ông cáo già bảo vệ và yêu thương mà còn bị hút cạn mật ngọt, khiến cho sức mạnh cân bằng để giữ vững trung tâm và sống sót trên đời bị phá vỡ. Cứ thế, họ dần rơi xuống vực sâu và đưa ra những lựa chọn虚妄 hư vọng như vậy. Nếu họ gặp những chàng trai đồng trang lứa, cùng có trái tim tươi trẻ thì đã có thể yêu đương đẹp đẽ biết bao. Cần phải tạo ra một lớp bảo vệ trong xã hội, ngăn chặn những kẻ đã quá từng trải lảng vảng quanh những cô gái trẻ ngây thơ.",187
866,"""Sugar daddy - sugar baby à? Thật là buồn nôn.""",18
867,Sốc thật. Thế giới này. Mạt thế rồi.,13
868,"Thật đáng sợ, thế giới này...",8
869,Ảnh này không thấy trên tin tức nhỉ,8
870,Kim Soo Hyun giỏi thật.,6
871,"Thật đáng thương. Xin chia buồn sâu sắc, mong người đã khuất yên nghỉ. Xin gửi lời chia buồn đến gia quyến.",28
872,"Kim So-hyun à, thằng kia, trả lại Im Sae-ron đây! Cô ấy là diễn viên mà tao thích nhất đấy, thằng này!",34
873,Chà... án tù giam được xác nhận rồi kìa Để xem Kim Soo-hyun vào tù nhé Đáng đời.,22
874,Chắc chắn là dùng tiền đè bẹp rồi.,10
875,"Đang chán muốn chết đây, may mà gặp được mày.",13
876,Thông báo chứng nhận là một thủ tục trước khi kiện tụng. Sao lại có nhiều tin nhắn chưa xem đến vậy...,25
877,"Có vẻ như có gì đó giữa Lee Jin Ho, người tự xưng là ""Tổng thống giải trí"", và công ty quản lý của Kim Soo Hyun. Mỗi khi Kim Sae Ron định làm gì đó, Lee Jin Ho lại làm video ""bới lông tìm vết"", tạo ra một lượng lớn bình luận ác ý khiến cô ấy không thể làm gì được. Ngay cả hai tháng trước khi Sae Ron bắt đầu làm việc bán thời gian, anh ta cũng đăng một video ""bới lông tìm vết"" với tiêu đề ""Hành động rùng rợn"" để tạo ra làn sóng bình luận ác ý. Nhưng phóng viên giải trí như anh ta lại không hề đả động gì đến nội dung hot về Kim Soo Hyun như bây giờ? Đối với những nghệ sĩ mà anh ta quyết tâm hạ bệ thì thậm chí còn livestream khẩn cấp Anh ta nói rằng đã đăng video để giúp Sae Ron trở lại, nhưng tiêu đề lại là ""Hành động rùng rợn""... Thay vì hối hận, anh ta còn nói rằng cô ấy không nghe điện thoại...",226
878,"Thằng khốn nạn hèn hạ, độc ác, giả tạo ngây thơ làm tao ghê tởm.",20
879,"Việc gặp gỡ giữa người trưởng thành và trẻ vị thành niên dưới 16 tuổi không phải là bất hợp pháp. Tuy nhiên, nếu có hành vi quan hệ tình dục, bất kể có đồng thuận hay không, người lớn sẽ bị trừng phạt vì tội cưỡng hiếp trẻ vị thành niên theo luật định. Hình phạt cho tội cưỡng hiếp trẻ vị thành niên theo luật định là từ 3 năm tù trở lên. Người chết thì không nói được gì,... Chỉ nghĩ đến việc phải khăng khăng khẳng định đó không phải là Kim Soo-hyun thôi là đã thấy tức giận rồi.",122
880,Làm ơn hãy làm phụ đề tiếng Anh để những người không biết tiếng Hàn có thể hiểu được ạ,20
881,"""Su-hyun oppa, em là Saeron đây ạ. Em đã nhận được chứng nhận nội dung anh nói anh kiện em. Em đang chuẩn bị rất chăm chỉ cho sự trở lại của mình, và em sẽ trả anh ít nhất vài phần trăm từ tất cả các tác phẩm của em. Em không nói là em sẽ không trả anh. Nếu anh đòi em 700 triệu won ngay lúc này trong tình hình này, em thực sự không thể làm được. Không phải là em không làm, mà là em không thể làm được, anh thực sự phải làm vậy sao? Xin anh hãy cứu em. Em xin anh. Xin anh cho em chút thời gian ạ.""",139
882,Tôi đã có cái nhìn khác về Kim Soo Hyun...<br><br>Thật tiếc cho Saeron quá,23
883,"Chắc hẳn đã rất ấm ức khi bị chế giễu là tự tạo tin đồn hẹn hò, vậy mà đã hẹn hò tận 6 năm...",27
884,"Tuổi giữa 20 bây giờ vẫn còn là trẻ, mà nghe đau lòng quá. Quá tàn nhẫn với đứa trẻ 1516 tuổi.",26
885,Kim Soo Hyun sẽ giết con ác quỷ đáng nguyền rủa đó như thế nào đây?!,19
886,Tuyệt vời. Viện nghiên cứu Garo Sero nói như vậy sao? Tin tức đang rầm rộ cả lên. Về sau tôi cũng sẽ luôn ủng hộ việc thả tự do cho Tổng thống.,41
887,Vốn dĩ bọn ấu dâm hết hứng thú khi đứa trẻ thành người lớn mà.,16
888,Cảm ơn thầy/cô ạ.,8
889,"Wow, trước giờ tôi cứ nghĩ Gaseyeon là thứ đáng để tẩy chay, nhưng nhờ vụ này mà tôi đã thay đổi suy nghĩ... Dù người đã mất rồi, nhưng cảm ơn vì đã giải oan cho Kim Sae Ron.",52
890,Chị Suhyun sẽ trở thành kẻ ăn xin vì cái quỹ 위액금 đó cho coi. Đồ xấu xa ㅡㅡ,24
891,"Chắc hẳn là đã xây dựng hình ảnh rất tốt rồi, bằng chứng rành rành mà vẫn có cả đống người không tin.",27
892,Điên rồi.,5
893,Hắn ta quá kinh khủng...,8
894,"Kim Soo Hyun của Trung Quốc hay gì đó, Kim Soo Hyun biến đi!!!!",19
895,Rớt xuống địa ngục đúng là chỉ trong khoảnh khắc...,14
896,"Có bằng chứng thật sự hẹn hò không vậy? Không phải là móc mỉa gì đâu mà là do video dài quá xem hơi lười, nếu có bằng chứng thật thì nói cho mình biết với.",43
897,Có hết trong video rồi.,7
898,"Tìm Dispatch mà xem, tóm tắt thôi. Bên Kim Sae Ron bảo còn chứng cứ nữa nhưng Dispatch chỉ công bố 2 tấm thôi. Bên đó muốn Kim Soo Hyun thừa nhận và xin lỗi đó Dispatch cũng đang cố cắt đuôi, chắc chắn còn gì đó nữa nhỉ?",59
899,Lớp 3 ơi,3
900,Nếu mà tung ảnh hôn hồi cấp 2 ra thì có khi Kim 씨 đã chi ra tầm 700 triệu won rồi ấy chứ...,25
901,Đúng là như này còn gì Đúng là trình độ ấu dâm quốc gia Nếu là nước ngoài thì Kim Soo-hyun đã ở trong tù rồi.,30
902,Có vẻ như Gaseyeon sắp gặp chuyện lớn rồi... Bên phía Kim Soo Hyun nói sẽ có hành động pháp lý đấy.,28
903,Chà... Kim Soo Hyun là người như vậy sao.,11
904,"Ah, hôm qua đi ăn Shabu OOO về, chẹp chẹp.",17
905,"Ngay cả khi trẻ con thích đi chăng nữa thì với tư cách là người lớn cũng nên vạch rõ ranh giới. Hồi cấp 3, tôi thích một anh nhà thờ 32 tuổi, bám ảnh dữ lắm, nhưng anh ấy vạch rõ ranh giới và không đối xử với tôi hơn một người trong đạo nên tôi tự hiểu là không có gì và tự nhiên coi anh ấy như một thầy giáo ở nhà thờ.",84
906,Dispatch khui hết rồi nhé. Tạm biệt.,10
907,"Cái đéo gì thế này Lúc chửi Kim Sae Ron thì xát muối tận gốc, giờ lại bênh à Dispatch",24
908,Hãy cùng nhau kiến nghị đuổi Lee Jin Ho đi. Loại rác rưởi đó.,17
909,"Tôi làm nghề cầm đồ, răng vàng mà đem tới là tôi nhai hết đấy.",17
910,"Người trưởng thành với người 10 tuổi khác với trẻ vị thành niên với người 10 tuổi, người lớn cóCommon sense thường thức thì biết rõ điều đó mà. Bọn trẻ con thì biết cái gì... Vụ việc ghê tởm vãi.",51
911,Tạm biệt Kim Soo Hyun.,6
912,"Bài trừ thân Trung, thân Triều Tiên",9
913,Cái quái gì vậy?,6
914,"Chắc Kim Soo Hyun cũng chỉ nói những điều đúng đắn như đảng Dân chủ nên mới bị nổi đóa lên nhỉ, nhìn cái kiểu đòi kiện tụng là biết rồi.",36
915,"Suhyun à Khi nào thì kiện đâykkkk Bảo là oan ức lắm mà, nhanh nhanh nộp đơn kiện đi xem nào. Ui chà, lại còn lôi cả đứa trẻ 14 tuổi ra... Chắc giờ run bần bật vì sợ thành tội phạm ấu dâm hả",56
916,Chắc chắn một điều là Kim Se-ui là người trọng nghĩa hơn tiền bạc. Thật lòng.,20
917,Tôi xin tố cáo Kim Soo-hyun.,9
918,Rồi có ngày tôi cũng xem kênh Gaseyeon...,12
919,"Tôi phát điên lên vì tuổi của Sae-ron bằng tuổi đứa em út của tôi. Anh đang hẹn hò và chơi đùa với một đứa trẻ con à. Lúc đứa trẻ đó, người mà anh từng yêu, gặp khó khăn nhất, anh không thể thông cảm cho em ấy dù chỉ một chút thôi sao. Anh có hạnh phúc không khi em ấy kết thúc bằng cái chết. Đừng có bán nước kiếm tiền ở Trung Quốc, nghe nực cười thật đấy.",96
920,Phản đối luận tội! Bầu cử gian lận!,13
921,"Cho là hẹn hò đi, nhường nhịn nhau trăm lần cũng được... Nhưng mà đưa người ta về công ty quản lý của mình, bắt làm việc không lương... Còn hứa là sẽ giải quyết vụ tai nạn lái xe khi say xỉn... Sao giờ lại đột ngột gửi thông báo đòi nợ thế? Lúc đầu giải quyết thì phải nói rõ thời hạn trả nợ chứ... Sao lại dồn người ta đến chân tường vậy... Đã cùng nhau trải qua 6 năm trời, đến cuối cũng phải cư xử có lễ nghĩa chứ, hành động như kẻ thù không đội trời chung, đúng là ác quỷ...",127
922,"15 tuổi... haizzz, Soo-hyun à. Rốt cuộc sự thật là gì vậy?",23
923,"Tôi không biết những cái khác, nhưng<br>Người ủng hộ là Bergkamp bằng tiếng Hàn haha<br>Anh ấy là người Hà Lan haha",36
924,Lee Jin Ho vẫn chưa tỉnh táo lại kìa,9
925,"Nếu không có những kênh lớn như Kaseyeon, những kẻ liều lĩnh như chó săn, thì vụ này có lẽ đã bị chôn vùi trong im lặng theo sự ăn ý giữa công ty quản lý và phóng viên giải trí. Thật đáng sợ. Không bàn đến việc thích hay ghét Kaseyeon, tôi ủng hộ việc họ đào sâu vụ này.",75
926,"Su-hyeon chửi bố mình, rồi lại còn bẩn thỉu và xấu xa hơn cả bố mình, đúng là dòng máu không thể nói dối mà... Mong là vụ này sẽ được làm sáng tỏ triệt để và nếu Kim Su-hyeon có tội thì phải có biện pháp xử lý theo pháp luật.. Mong Viện Nghiên Cứu Garo Sero làm sáng tỏ triệt để vụ này.",80
927,"Nếu người yêu tôi, người mà tôi đã hẹn hò 6 năm, qua đời. Chắc chắn tôi sẽ không thể đến những bữa tiệc như thế này trong một thời gian.",36
928,"Nếu có nhân tính đến mức đó thì đã không làm chuyện như vậy rồi... Ngược lại, có lẽ hắn ta đã thấy nhẹ nhõm vì giờ đã chết nên không còn ai đứng ra tố cáo và mọi chuyện đã kết thúc.",50
929,Đồ đáng bị trời phạt.,6
930,15 tuổi vị thành niên mà... ha... còn là người không vậy.,15
931,"Xem tử vi của Kim Soo-hyun, người ta đã bảo phải cẩn thận lời ăn tiếng nói trong năm nay rồi mà, ai dè đâu Chắc là vì lòng tham cá nhân, không muốn bị hắt nước bẩn vào người nên mới không đi đám tang. Won Bin cũng đến và thành tâm thương tiếc mà 참 . .",67
932,"Hóa ra là có lý do không đi viếng. Wow, thật sự là quá sốc. Su Hyun à, dù có nhường nhịn đến 100 lần đi nữa, cũng không thể để người phụ nữ ra đi như vậy được.",49
933,"Đến kỳ gia hạn hợp đồng, tôi đã liên lạc với công ty quản lý và Kim Soo Hyun nhưng không ai trả lời. Sau đó, họ gửi cho tôi một thông báo có tính chất đe dọa rằng hợp đồng không được gia hạn...",53
934,"Chắc hẳn công chúng hoàn toàn không biết những sự thật này, giờ biết tường tận rồi thì... không biết phải nói gì nữa.",27
935,"Chỉ cho làm phim độc lập kinh phí thấp, bản thân thì kiếm cả đống tiền rồi đem đi quyên góp cho Trung Quốc... Chắc là có thế lực chống lưng.",36
936,Tôi nghĩ ban đầu có vẻ như họ đã tạo dựng phong cách này bằng tiền của Trung Quốc.,20
937,Bí mật vĩ đại,4
938,Đáng bị trời phạt.,5
939,Chà... con người đáng sợ thật.,8
940,"G là viết tắt của ""Gak"" trong tiếng lóng Indonesia, có nghĩa là ""không"". ""Bhsa Indonya"" là viết tắt của ""Bahasa Indonesianya"", có nghĩa là ""tiếng Indonesia của nó"". => Không phải tiếng Indonesia à.",64
941,"Su Hyun à, đi mạnh giỏi nhé",8
942,Có lẽ bà Shim là người Hoa kiều.<br>Nếu không thì có thể là tổng quản người Hàn Quốc điều hành dòng tiền của Hoa kiều trong giới giải trí.,37
943,Đúng là Seho đáng bị unfollow thẳng tay mà. Haizz,14
944,Chắc không còn dính dáng gì đến Kim Ji-won nữa đâu,12
945,Bạn không có chút tình cảm nào với bạn gái cũ đã hẹn hò 6 năm sao? Anh thật là một người tồi tệ. Tôi cảm thấy mọi chuyện sẽ bị phơi bày thôi.,37
946,Mỹ hay Trung Quốc đều đáng bị tử hình.,10
947,Có vẻ như Dispatch đang cố gắng thoái thác trách nhiệm bằng cách liên tục nhắm vào Kim Soo Hyun.,21
948,"Có vẻ như bạn viết nhầm từ ""túi xách của chị/em chồng"" rồi.",21
949,Ngoài Gaseyeon ra thì còn chỗ nào dám phát sóng thẳng thắn những nội dung như này nữa không...? Gaseyeon là con dao căm phẫn của những người yếu thế và oan ức.,42
950,Một người đàn ông 27 tuổi hẹn hò với một cô gái 14 tuổi là chuyện bình thường sao? Điên rồi à? Tôi đã xem cuộc phỏng vấn và người đàn ông này chắc chắn bị thu hút bởi các cô gái trẻ. Mong rằng công lý sẽ được thực thi.,56
951,"Trực giác: Kim sae ron Yên nghỉ nhé cô bé với ánh mắt ngây thơ. Kim soo hyun trưởng thành với ánh mắt đen tối. Nếu cái kết bi thảm này không bị trừng phạt, họ sẽ phạm phải một tội ác kinh khủng, đó là ""bình thường hóa ấu dâm"". Trong khi đó, XX hy vọng rằng xã hội được củng cố bởi một kỷ luật không thể lay chuyển, sẽ rơi vào hỗn loạn và tan thành từng mảnh.",102
952,"Dù không có trách nhiệm pháp lý đi chăng nữa... thì người ta, con người ta, ắt phải có trách nhiệm đạo đức, trách nhiệm về mặt đạo nghĩa... Nếu không biết điều đó thì chẳng khác gì cầm thú chứ không phải người... Trong những lời mà diễn viên Kim Sae Ron đã nói có câu như này: ""Tôi đã bị tiêu thụ với một hình ảnh sai lệch trước công chúng và nhận được sự nổi tiếng... Tôi muốn sửa chữa những sự thật sai lệch."" Thật là cay đắng...",112
953,"Gửi Kim Soo Hyun.<br>Tôi là người không tin vào thiên đường địa ngục và thấy những người tin vào điều đó có vấn đề về trí tuệ, chỉ biết cười khẩy.<br><br>Thật sự mong anh xuống địa ngục đi.<br>Tôi không còn gì để nói ngoài điều này.",67
954,Chắc Kim Soo-hyun chẳng những không hề hối lỗi mà còn đang tự biện minh cho bản thân ấy chứ,22
955,Cứ thế này thì có khi đến khu bán máy biến áp cũng bị tẩy chay mất.,19
956,"Dù thế nào thì sự thật là gì, cũng phải nghe cả hai bên nói đã.",19
957,Mẹ mày.,3
958,Đến bao giờ thì mới thôi bênh cả hai bên vậy ㅅㅂ mẹ mày,15
959,"Ôi, tưởng là trai Hàn, ai ngờ là ARMY mẹ bỉm sữa đầu óc tỉnh táo à",22
960,Huyền thoại Ala Chung.,6
961,Ngay cả khi quan hệ tình dục có sự đồng thuận thì vẫn cấu thành tội statutory rape. Ở Trung Quốc thì bị tử hình.,30
962,Đây không phải là mại dâm trá hình sao?,11
963,"Tôi đã thấy Kim Sae Ron hồi nhỏ trong ""Mười vạn thần"". Những kẻ lớn lên cùng nỗi hận ở bán đảo đầy hận thù này, lại càng nuôi lớn thêm nỗi hận đó. Bất kể tả hay hữu, tất cả đều như vậy...",55
964,"Đông Yeon à, mày thèm khát chức tổng thống đến thế cơ à? Thật đáng thương.",20
965,Có phải nhờ bố không đấy? Park Joo-shin,12
966,"Thật sự không thể tin được, chuyện này không thể nào",12
967,Quá khứ không thể giấu được đâu hahaha.,11
968,"Vẫn còn chưa xin lỗi mà cứ nằm ườn ra đấy, đến khi nào xin lỗi thì làm tới 523 tập phát sóng bóc phốt luôn nhé <br> Kim Se-ui fighting",38
969,"Nếu là con gái tôi, tôi đã không nhẫn nhịn như vậy đâu, tôi sẽ lao vào ăn thua đủ với chúng nó. Với một đứa trẻ 15 tuổi, đó có phải là hành động mà con người nên làm không?",50
970,"Bạn buồn quá, tôi hy vọng anh ta sẽ trả thù.",13
971,"Có lẽ Kim Soo-hyun đang chửi Kim Sae-ron ấy... Chắc đang chửi rủa kiểu ""Sao mày nhất định phải chết vào đúng ngày sinh nhật tao, định chơi đểu tao à?""",42
972,Như thế này là tội phạm tình dục rồi.,11
973,"Thích vì diễn xuất giỏi, ai ngờ... Ghê tởm.",17
974,Kim Soo Hyun đồ tồi,5
975,"Má ơi thằng này điên cmnr, số 1 phải vào bệnh viện tâm thần luôn á.",20
976,"Hình như thằng này có cái kiểu fetish trẻ vị thành niên cấp 2, cấp 3 ấy, hồi bé thì cho vay tiền, dẫn đi chơi, xong giờ già rồi, tốn tiền nhiều nên đổi sang yêu con bé vị thành niên khác à?",57
977,Saeron tội nghiệp quá...,6
978,Hình tượng của giới nghệ sĩ...,7
979,Ặc... muốn nôn quá.<br>28 tuổi sao lại đi hôn một đứa 16 tuổi?<br>Giải thích rõ cái đó trước đi.<br>Nếu không phải do mày khơi mào thì Kim Sae Ron đã không đến nỗi này.<br>Vậy nên người giàu tình cảm và yếu đuối không nên tin tưởng ai попало.,77
980,"Đúng vậy,,, Nếu người bắt đầu không phải là Kim Soo Hyun, thì cuộc đời của Kim Sae Ron có khả năng đã rất khác rồi,,,",37
981,Su Hyeon à... Toang rồi Tạm biệt nhé,11
982,"Cái này không phải là nên đưa lên ""Chuyện muốn biết"" 그것이 알고싶다 thay vì YouTube à?",26
983,Đéo mẹ cái này thì đúng là...;;;,12
984,"Ha, thật là cạn lời",6
985,Diễn viên Kim Soo Hyun cũng phải chịu trách nhiệm nữa.,12
986,"Nếu người phụ nữ chết như vậy thì cả đời sẽ bị dày vò. Người phụ nữ đã dâng hiến cả thân mình khi còn là vị thành niên, thật quá đáng.",37
987,"Thật sự buồn cho hoàn cảnh của Kim Sae-ron, và thật sự ngạc nhiên với lượng bình luận ở đây, buồn cười thật, vì tôi dám cá là có vài người từng bình luận ác ý về cô ấy khi bức ảnh với Kim Soo-hyun được tung ra. Thật là đạo đức giả.",64
988,Giờ thì dù có làm hậu truyện thành công đến đâu cũng không thể che lấp được chuyện này... Người ở lại trần gian cũng sống không bằng chết... Mong bạn giải tỏa hết mọi uất ức và an nghỉ nơi tốt đẹp.,48
989,"Ôi Kim Soo Hyun, Lee Jin Ho xuống dốc rồi",11
990,"Sae Ron à, tôi xin lỗi vì đã hiểu lầm em. Trong suốt thời gian đó, em đã phải khó khăn biết bao nhiêu một mình.",31
991,"Tôi kính trọng Giám đốc Kim Se-eui, người không dùng tiền để giao dịch ngầm.",21
992,Nếu mà là sự thật thì Kim Soo-hyun vì 700 triệu won cỏn con mà đẩy bạn gái xuống địa ngục rồi... Đúng là trên đời này không có bí mật nào cả....,40
993,"Là người thì phải đến đám tang chứ, dù có hẹn hò hay không.",16
994,Công ty chỉ có mỗi Kim Soo Hyun thôi à?,11
995,"Trong lúc đó, đội trưởng Kim Se-ui đeo băng đô lên trông đẹp trai hơn hẳn.",21
996,"""Gọi là 'gae-jeo-ssi' buồn cười thật đấy hahahaha.""",21
997,Vui lòng cho tôi xin phụ đề tiếng Anh.,9
998,Đáng bị luận tội.,5
999,Sốc quá... Tôi không nghĩ Kim Soo-hyun lại là người như vậy... Đúng là không thể biết được lòng người mà... Những người nổi tiếng... Lại một lần nữa nhận ra rằng những gì mình thấy không phải là tất cả...,50
1000,Cái watermark dễ thương vãi Watermark kiểu này mà dùng Paint tô màu xanh lên là xong ngay Sao cái watermark gì mà làm ẩu thế không biết,34
1001,"Mấy thằng nghệ sĩ trước giờ cũng thuộc hàng có số má sao toàn thích trẻ con vậy, có lý do gì à? Mẹ kiếp, cũng già đầu rồi, phải moi hết cái bộ mặt xấu xa ra mới được...",49
1002,Hắn ta là quái vật!!!,9
1003,"Hãy dịch sang tiếng Việt, làm ơn.",10
1004,Xuống địa ngục đi Soo Hyun à haha.,10
1005,Tôi rất thích cách xử lý mọi việc. Phản đối luận tội Yoon Suk-yeol!,20
1006,"Chà... giới giải trí đúng là không như những gì mình thấy. Tôi đã nghĩ Kim Soo Hyun là người tốt nhưng thật sự là hai mặt, sởn da gà.",35
1007,Ấu dâm à.,5
1008,Vui lòng cho phụ đề.,6
1009,"Ngay cả khi một đứa trẻ không phân biệt được đúng sai mà lao vào, thì việc khuyên bảo nó một cách tử tế mới là người trưởng thành, là người lớn....",38
1010,Kim Soo-hyun đúng là hết thuốc chữa rồi.,12
1011,Kim Soo-hyun đã hỏi Lee Jin-ho số điện thoại của Kim Sae-ron?,18
1012,"Kim Soo Hyun: Yêu đương rồi chia tay là chuyện bình thường mà, sao không ai hiểu cho tôi vậy?",24
1013,"Người chết thì làm sao nói được, rồi thì Hàn Quốc này sẽ dùng tiền để bịt miệng thôi. 6 tháng sau mọi chuyện lại như chưa từng có ấy mà.",34
1014,"Won Bin hyung, xem cái này xong anh định để yên cho Kim Soo Hyun hả? Tức giận dâng lên tận cổ rồi này.",28
1015,Hầu hết những chuyện liên quan đến họ Shim đều là tự sát...,16
