ID,Comment Text,Token Count
0,"Kiến nghị Quốc hội trừng phạt Lee Jin-ho Hãy cùng nhau ngăn chặn những thiệt hại gây ra bởi YouTuber kiêm phóng viên giải trí Lee Jin-ho, người liên tục gây ra những hành vi sai trái. #ViệnNghiênCứuGaroSero #Gaseyeon #KiếnNghịQuốcHội #XinHãyThamGia",71
1,"Cách thức kiến nghị nhanh chóng và dễ dàng = Không cần đăng ký thành viên, sau khi nhấn vào [Xác thực không phải thành viên], đừng nhấn vào nút màu đỏ dưới cùng mà hãy nhấn vào [Xác thực bằng tin nhắn SMS], sẽ nhanh hơn đấy.",59
2,"Những người hâm mộ Gaseyeon bị chặn nhầm do chặn các bình luận gây rối, hãy đến fan cafe chính thức của Gaseyeon, Gafancl và cho chúng tôi biết trong thông báo [Thông báo liên quan đến chặn] nhé.",57
3,"Đồng ý, đã nhấn.",6
4,Hoàn thành.,3
5,"Nhìn quần áo thì giống với mấy tấm ảnh cọ má cọ má rần rần trước đây. Nghe nói hồi đó Kim Sae Ron mới mười mấy tuổi, còn cọ má rồi hôn hít với cả trẻ vị thành niên nữa. Lúc xem Good Day thấy quý mến vậy mà... Haizzz, thôi thì hủy quảng cáo rồi nhận tiền phạt hợp đồng cho đáng đời đi.",78
6,"Ôi trời ơi, đồ tồi tệ.",9
7,"Tôi đã từng nghĩ Gaseyeon là người xấu, nhưng sau khi thấy họ tố cáo Baek Jong-won và Kim Soo-hyun, những người có quyền lực lớn, tôi đã phải nhìn nhận lại.",45
8,Chắc hẳn là vua chúa thời Joseon không hẹn hò với học sinh cấp hai đâu nhỉ.,20
9,Đời tôi thật đáng thương.,6
10,Kim Soo Hyun là đồ rác rưởi. Nghĩ đến Sae Rom mà đau lòng quá.,20
11,Lee Jin-ho cũng đúng là đồ rác rưởi. Phải tống cổ cái thằng Lee Jin-ho đó vào tù chung thân.,25
12,Phải làm cho Kim Soo Hyun bị giới giải trí ruồng bỏ.,14
13,Trên trán viết phản đối luận tội kìa,8
14,Thật đáng tiếc Sự thật thì chỉ có họ mới biết thôi. Mong là họ đừng vui mừng quá,20
15,Loại cha mẹ nào lại biến con gái đã chết thành chủ đề bàn tán vậy? Loại người đẩy cả người sống vào chỗ chết là loại người không có lương tâm. Xin hãy dừng lại đi.,41
16,"Thằng đó mà là học sinh cấp 2 thì bằng tuổi con trai tôi rồi. Đúng là thằng khốn, đáng bị trời phạt. Phải từ bỏ hết Disney Trung Quốc thôi.",38
17,Chúng tôi hoàn toàn ủng hộ bạn.,8
18,"Tôi đọc các bình luận và bị sốc, làm sao có thể phần lớn mọi người lại nhảy lên chuyến tàu lạm dụng truyền thông như vậy, họ thậm chí không tìm kiếm sự thật từ một quan điểm trung lập hay tự mình suy luận. Thật là một xã hội điên rồ! Đây là lý do thực sự tại sao các nghệ sĩ của họ biến mất khi còn trẻ, vì sự bắt nạt trên các phương tiện truyền thông, điều này đáng lẽ phải bị xử phạt và cấm ở cấp quốc tế. Tôi nghĩ người tiếp theo đang đến gần vì những bình luận của các bạn, hãy suy nghĩ về điều đó",129
19,"Nhưng mà nghe nói Kim Soo Hyun với Kim Sae Ron chia tay rồi, cô ấy kết hôn với người khác ở nước ngoài và sống ở đó mà... Vậy thì mối quan hệ với Kim Soo Hyun trong quá khứ đã kết thúc rồi, cô ấy phải bàn bạc với chồng mình chứ? Dù Kim Soo Hyun có nhiều tiền đi chăng nữa thì Kim Sae Ron đã là người trưởng thành, gây ra tai nạn lái xe khi say rượu, người yêu cũ có nghĩa vụ phải giúp đỡ sao? Và chuyện quá khứ có yêu đương với người vị thành niên hay không có vẻ không phải là trọng tâm? Có vẻ như họ đang khơi lại chuyện quá khứ để tạo ra một vấn đề khác thôi.",149
20,"Chỉ toàn kích động cảm xúc để biến Kim Soo Hyun thành rác rưởi, chẳng có kết luận gì cả. Việc đó thì liên quan gì đến chuyện hẹn hò khi còn vị thành niên?",42
21,Cách kiếm tiền thì muôn hình vạn trạng. Tỉnh táo lại đi.,14
22,"Tất cả các bà mẹ ở Hàn Quốc phải bảo vệ mẹ của Kim Sae Ron. Vấn đề này rất nghiêm trọng. Nếu văn hóa Hàn Quốc không đủ mạnh để giải quyết vấn đề này, sẽ có nhiều Kim Soo Hyun hơn trong tương lai. Ảnh hưởng của người mẹ là vô cùng lớn. Mong tất cả các bà mẹ Hàn Quốc hãy ủng hộ vai trò của Kim Sae Ron trong việc đấu tranh cho công lý cho người con gái xinh đẹp đã chết dưới bàn tay của những kẻ ấu dâm tàn ác.",107
23,"Đừng sợ cái chết, thưa mẹ. Nếu con là mẹ, con sẽ không màng đến sống chết mà chiến đấu đến cùng. Đừng mong cầu sự bình yên. Hãy nhớ rằng họ đã vô cùng tàn nhẫn với mẹ con Kim Sae Ron, tàn nhẫn và đáng thương đến mức chưa từng gặp Kim Sae Ron, không nhận điện thoại, và không muốn cho Kim Sae Ron cơ hội trả nợ. Thưa mẹ Kim Sae Ron, đừng sợ hãi, hãy chiến đấu đến giọt máu cuối cùng, tiến lên cho đến khi chết để những kẻ gây ác cho con gái yêu quý của mẹ phải cảm nhận được sự tàn khốc mà chúng đã gây ra. Hãy dốc hết sức mình.",146
24,"Kiếm thì kiếm được nhiều thật nhưng mà không có gì đặc biệt mà lại còn quá to nữa. Về mặt ngoại hình thì phải là Jung Woo Sung... Thành thật mà nói, phải có chút tinh tế để thừa nhận và công nhận điều đó chứ. Kim Soo Hyun đúng là đồ hèn nhát.",62
25,Từ giờ tôi sẽ không dùng bất kỳ sản phẩm quảng cáo nào của Kim Soo Hyun nữa. Hoàn toàn vô liêm sỉ... Coi thường và kiêu ngạo với tất cả người tiêu dùng và người xem. Quá xảo quyệt.,45
26,"Đây đúng là một hành động tàn nhẫn để thúc đẩy động lực, Kim Soo Hyun nhỉ?",21
27,Một người đã chết.,5
28,Lại định giết thêm một người nữa hả? Vừa vừa thôi. Cả hai đều chẳng tốt đẹp gì đâu,21
29,"Tôi chắc chắn rằng tất cả những người phàn nàn ở đây đều là những người ghét người đã khuất khi còn sống. Những kẻ đạo đức giả!! Đến tận bây giờ, họ vẫn cố gắng ""làm trong sạch"" tên tuổi của cô ấy vì cái gọi là người dì, người đã không giúp đỡ gì cho cuộc đời cô ấy khi cô ấy còn ở cùng người thân? Khi cô ấy cần, cô ấy đã tìm đến bạn bè. Khi cô ấy còn sống, họ chỉ coi cô ấy như một cái máy ATM và bây giờ họ vẫn muốn lợi dụng ký ức về cô ấy.",127
30,Còn sót lại cả video kiểu này được đăng lên hồi vụ Lee Sun-kyun nữa này.,20
31,"Thật sự thì Gaseyeon làm việc cho đất nước nhiều hơn cả các nghị sĩ của đảng Sức mạnh Quốc dân. Cảm ơn vì đã đứng ra làm những việc khó khăn. Tôi xin được ủng hộ chút ít. Và tôi có một thắc mắc là nếu gọi là ""각하"" bệ hạ thì liệu phe Dân chủ có vịn vào đó để luận tội lần nữa không? Tôi nghĩ rằng nếu bác bỏ thì sẽ không còn lý do gì để luận tội nữa, đó là suy nghĩ cá nhân của tôi.",107
32,Mọi người xem video vừa mới lên chưa? Kết hôn cơ đấy... Haizz... Đến nước này rồi mà vẫn đổ tại Kim Soo Hyun gây ra cái chết à? Chắc chắn là biết chuyện này rồi nhưng sao không nói ra? Vừa phải thôi đi.,54
33,"Tôi nghe nói là khi Kim Sae Ron lái xe trong tình trạng say xỉn, có việc công ty tiếp đãi rượu đến tận sáng. Xin hãy xác nhận tính xác thực của việc này. Fan cần biết sự thật để giải tỏa hiểu lầm.",52
34,Tôi tha thiết mong Kim Sae Ron sẽ được phục hồi danh dự. Thật tiếc cho Sae Ron quá. Thật đau lòng.,27
35,"DỪNG LẠI HÀN QUỐC, ĐỦ RỒI ĐẤY, ĐỪNG VU KHỐNG VÀ TUNG TIN ĐỒN ĐỂ PHÁ HOẠI HÌNH TƯỢNG NỮA, KIM SOO HYUN KHÔNG PHẢI LÀ NGƯỜI ĐẦU TIÊN ĐÂU, CÓ NHIỀU NGƯỜI ĐÃ PHẢI CHẾT VÌ ÁP LỰC CỦA BÁO CHÍ GIẬT GÂN RỒI, DỪNG LẠI DỪNG LẠI",107
36,Ai đã tiêu hết tài sản của Kim Sae Ron vậy? Kim Soo Hyun à?,19
37,Tự sát à!,4
38,"Lại tóm được một vụ ngang dọc nữa rồi. Đúng là lũ trẻ trâu, định moi được bao nhiêu tiền đây.",27
39,Tôi theo dõi tin này...tôi đến từ INDONESIA,14
40,"Kể cả khi súng kề vào đầu mày, mày vẫn ủng hộ thiết quân luật à?",19
41,"""Tả khuynh là gì?""",9
42,"""Chó sủa cái gì vậy?""",9
43,Mấy thằng GaSeYeon đúng là lũ điên.<br>Chuyên moi móc chuyện của người khác để kiếm tiền.,24
44,Vậy là mọi người đều muốn Kim Soo-hyun cũng thất bại nên mới làm vậy hả?? Vừa vừa thôi đi.,25
45,Đến tôi còn không ngờ mình lại đi cổ vũ cho Garo Sero.,15
46,Dậy đi anh Kim Soo Hyun ơi.. Anh phải làm việc thật chăm chỉ thì mới có thể vượt qua được cơn bão này. Chúng em luôn ủng hộ anh. Anh phải đứng lên và xuất hiện thật tươi tỉnh nhé. Vấn đề xảy ra bây giờ chỉ là chuyện quá khứ thôi. Em tin anh có thể vượt qua được.,69
47,"Thật không thể tin được làm sao tin buồn này lại lan đến khắp thế giới, chúng ta không muốn thấy thêm bất kỳ kẻ ấu dâm nào trên thế giới nữa.",35
48,"Nếu không có luận tội Yoon Suk-yeol, thì đây không phải là đất nước.",19
49,"Cảm ơn vì đã xử lý vấn đề đúng cách, Kim Se-ron.",16
50,"Không còn gì để nói, cái nơi này chắc chắn là trại tâm thần rồi",17
51,Có thể thêm phụ đề Trung-Anh không? Thật sự không hiểu gì cả.,17
52,"Vậy thì xem ra Jo Se Ho cũng tham gia vào ngày 25, không phải là người đoạn tuyệt nhanh nhất nhỉ... Cùng nhau uống rượu, vui chơi mà bảo là đoạn tuyệt thì lời nói khác mà...",45
53,"Một người phụ nữ đã phải vật lộn từ khi còn nhỏ bị hủy hoại bởi công ty vàng, Kim Soohyun, cư dân mạng, youtuber Lee Jun hoo, thật tàn nhẫn khi họ đối xử với con người.",51
54,Chính những người đã công kích cô ấy trên mạng xã hội giờ đây lại mang dòng máu của cô ấy.,22
55,"Đây là nhà báo á?? Tính chuyên nghiệp quá kém. Cứ lúng túng, đâm đầu lung tung, chia rẽ tất cả những người được nhắc đến, luận điểm thì không có logic, tư duy đen trắng như đứa trẻ 5 tuổi, quá nhiều kẻ thù. Cũng đáng bị loại khỏi đề cử của Quốc dân chi lực. Đến học sinh cấp 2 bây giờ trình độ còn cao hơn. Đừng lôi người chết ra mãi thế nữa, không thấy có lỗi với Saeron à!",105
56,"Chuyện nam nữ yêu nhau rồi chia tay... là chuyện thường tình, nhưng nói là vứt bỏ như đôi dép rách thì có chấp nhận được không?",32
57,Đồ chương trình bẩn thỉu đem chuyện của Sae Ron đã chết ra để thao túng chính trị!! Ghê tởm. Chuyện của Sae Ron khi nào mới ra đây!!,40
58,Kim Soo Hyun đúng là ông chú ngớ ngẩn thật.,12
59,Một gã sống cho ngày mai sẽ là miếng mồi ngon khi đối đầu với một gã sống cho ngày hôm nay.,23
60,"Mày tệ lắm Garosero, cố lên Kim soo hyun.",13
61,Cái không gì vậy,4
62,"Không thể tin được những người này hủy hoại cuộc sống của diễn viên như thế nào, hy vọng họ kiện bọn chúng.",28
63,Thằng chó nhân cách rác rưởi Chôn sống nó đi!!!,15
64,Mày sẽ phải trả giá bằng cái chết!!,11
65,"Xã hội Hàn Quốc thối nát, chúng nghĩ mình hoàn hảo nên mới có nhiều vụ tự tử đến vậy.",24
66,"Nhưng nếu bố mẹ biết từ lâu rồi, sao không tố cáo đi?",17
67,700 triệu làm tôi bật cười. Cuộc đời tiêu rồi haha. 700 triệu 700 triệu 700 triệu hahaha. Đồ ngốc.,28
68,Thật đau lòng cho Saeron.<br>Nhưng mọi chuyện chỉ có hai người biết.<br>Việc dồn Kim Soo Hyun vào thế này và hủy hoại cuộc đời một người là sai trái.,44
69,Kênh này cũng vậy. Người đã khuất Lee Sun Kyun cũng là một nạn nhân.,18
70,"YouTube tàn nhẫn, nơi người thứ ba xâu xé lỗi lầm của người khác đến tận linh hồn. Không hề xem xét hoàn cảnh hay môi trường của người được gọi là thủ phạm, chỉ thể hiện bản năng động vật tàn nhẫn.",51
71,"Mong Kim Soo Hyun vượt qua được khủng hoảng này. Nếu có làm sai, hãy xin lỗi. Mong anh đừng để bị lung lay bởi mấy kênh YouTube này.",34
72,"Thấy cái thằng phản đối luận tội bênh vực Shin Se-kyung, đúng là không hợp tí nào...",23
73,"Không thể bỏ qua loại người này được, phải trừng trị thôi.",14
74,Vô cùng thương tiếc Kim soo hyun.,8
75,Đây có phải là tài khoản thật của Garesero không vậy?,15
76,Không có tiếng Indonesia hả bạn?,8
77,"Xin chào. Tôi đến từ Argentina. Tôi đang sử dụng máy dịch để giao tiếp. Chúng tôi nghĩ rằng xã hội Hàn Quốc rất khắc nghiệt với những người nổi tiếng. Thay vì cho họ cơ hội sửa chữa sai lầm, họ lại quấy rối đến cùng và cuối cùng dẫn đến cái chết. Trong trường hợp của Kim Sae Ron, tôi nghĩ cô ấy còn quá trẻ và không đáng phải chịu đựng đến vậy. Mặt khác, Kim Soo Hyun có lẽ là một trong những diễn viên được yêu thích và nổi tiếng nhất ở nước ngoài, nhưng việc qua lại với trẻ vị thành niên là điều không thể tha thứ được, và trong thế giới này, không có cách nào để anh ta phục hồi danh tiếng của mình. Anh ấy đã mất hàng nghìn người hâm mộ và hoàn toàn bị chỉ trích vì thao túng và quan hệ với trẻ vị thành niên. Nhưng khi nhìn vào những cuộc tấn công vào Kim Sae Ron, tôi cảm thấy sự căm ghét quá mức của cư dân mạng Hàn Quốc thật đáng sợ!",212
78,Hãy ngăn chặn các tác phẩm mới của Disney Plus và khiến họ phải bồi thường thiệt hại hàng trăm tỷ won... Hãy phản đối Disney Plus.,30
79,"Lần đầu bình luận, với thu nhập của Kim Soo Hyun thì 700 triệu won chắc chỉ đáng giá một bát cơm thôi nhỉ... Sao đến cả cái đó cũng muốn ăn hết vậy, phải làm đến mức này sao...",47
80,"Chắc phải quay ""Tôi thấy ác quỷ 2"" với vai chính mất",14
81,Xin thành kính phân ưu.,6
82,"Mày đúng là đồ tồi tệ, con bé đó là bạn gái mày mà mày đã ngủ cùng, rồi mày đá nó và còn ép nó trả nợ.",33
83,"Thật sự là có rất nhiều lựa chọn để làm rất nhiều hành động khác nhau, vậy mà việc cố gắng quyết tâm nhất lại là tự kết liễu đời mình vào ngày sinh nhật của người đó... Chuyện này có lý không vậy?",49
84,"Tôi nghe nói Linoui = Simmadam = Choi Jinsil = Jo Sungmin = Choi Jin Young đều có liên quan đến nhau. Choi Jin Young có quen biết với Simmadam. Sau khi kết hôn, anh ấy giới thiệu Simmadam để giúp Jo Sungmin tìm đối tác kinh doanh, và rồi Simmadam phải lòng Jo Sungmin. Choi Jin Young cảm thấy đau khổ vì tội lỗi đó, mâu thuẫn giữa Choi Jinsil và Jo Sungmin ngày càng sâu sắc, vậy.vậy. Sau đó, Linoui ra mắt. Những người nổi tiếng thân thiết với Simmadam đều mang túi Linoui và đi khắp nơi, quảng bá cho nó. Tôi nghe nói rằng giám đốc thực tế = Simmadam có tầm ảnh hưởng lớn trong giới chính trị, giải trí, vậy.vậy. Thật đáng thương cho Saeron khi nghe thấy câu chuyện về Linoui ở đây. Tôi cảm thấy nghẹn lòng.",199
85,Một câu chuyện buồn. Cô ấy mất vào ngày sinh nhật của anh ấy. Ra đi quá sớm. Xin chào từ Indonesia. Đã đăng ký kênh của anh rồi nhé Oppa,39
86,Người bình thường ngay từ đầu đã không gặp gỡ vị thành niên rồi. Có vẻ như Kim Sae Ron còn quá nhỏ nên không biết nhìn người.,32
87,"Chắc hẳn đã tin tưởng vì được hứa hẹn sẽ lôi kéo đi khi hết hợp đồng với YG, đào tạo tân binh và chịu trách nhiệm!!!",33
88,Tôi đã từng có cái nhìn tốt về Kwanghee... Lee Si-eon cũng... Kian84 cũng Đang chơi bẩn thỉu với Kim Soo-hyun kìa.,36
89,Thật là nực cười khi một kẻ thích nội dung khiêu dâm như Moon Hyung-bae lại là Chánh án Tòa án Hiến pháp.,30
90,"Tổng thống Yoon Suk-yeol, cố lên!",13
91,Nếu không gặp Kim Soo Hyun thì chắc đã diễn xuất tốt và sống tốt rồi... Đồ con mẹ mày.,24
92,Bực thật. Những lúc thế này chẳng phải Tổng kiểm sát trưởng phải điều tra mạnh mẽ mới là bình thường sao?,25
93,Điều tra triệt để đến khi sự nghiệp tàn lụi.,11
94,"Không biết nữa nhưng chuyện này thật là mờ ám, vì nếu diễn viên kia được cho là có quan hệ với cô gái khi cô ấy 15 tuổi, nếu gia đình cô ấy biết chuyện, tại sao họ không kiện hoặc làm ầm ĩ lên? Đến tận bây giờ khi cô gái không còn nữa thì mọi chuyện mới thành ra thế này.",73
95,"Nhưng mà, bỏ qua mấy cái vấn đề thủ tục đi, cả nước người ta thấy hết rồi. Đêm hôm yên bình bỗng tan tành mây khói chỉ vì hành động sai trái của một người, vậy mà không có trách nhiệm gì, cứ lôi lỗi sai thủ tục ra nói... Thật là hèn hạ.",67
96,"Có tin đồn Kim Soo Hyun sinh năm 86, điều đó có thật không?",17
97,Vui lòng cho tôi bản dịch,6
98,"Căn hộ mà nữ diễn viên thể hiện trong chương trình tạp kỹ năm 2020 thuộc sở hữu của công ty của nữ diễn viên, và cô ấy đã tiếp quản công ty đó vào năm 2023, điều này đã được luật sư của cô ấy xác nhận vào thời điểm đó.",57
99,"Nếu mà thực sự thông minh thì đã tìm hiểu trước rồi. Từ 2009 đến 2016 là ở Fantagio, từ 2016 đến 2019 là ở YG.",32
100,Rác rưởi.,4
101,Có bản tiếng Indonesia không vậy,6
102,"Anh ta thật sự tệ bạc với người yêu cũ. Anh ta giàu có mà không giúp đỡ thì thôi, lại còn kiện ra tòa và chụp hình tin nhắn gửi cho báo chí. Nghệ sĩ này có lối sống không ra gì.",50
103,"Mặt thì giả nai, sau lưng lăm lăm dao nhọn. Còn đi gaslighting trẻ con, Rồi giở trò sàm sỡ. Mày sẽ bị trời phạt.",36
104,Eo ôi...,5
105,"Xin hãy thêm phụ đề tiếng Indonesia, làm ơn",13
106,Tôi đến đây vì xem TikTok... Lạc đến tận gốc thế này cũng không sao chứ nhỉ,19
107,Nói gì không hiểu gì hết trơn á haha.,11
108,Xin hãy tải ảnh lên thư viện theo ngày tháng năm để sự thật về Kim soo hyun và Kim sae ron nhanh chóng được phơi bày để có bằng chứng mạnh mẽ,34
109,Nếu là thật thì Kim Soo Hyun đúng là hình mẫu của нарцисист người mắc chứng нарцисизм...,34
110,Ước gì em ấy sống ngẩng cao đầu như chị Lee Ji Ah ở tuổi 15... Có vẻ như Saeron quá tốt bụng và non nớt.,30
111,Ngày xưa Baek Jong Won đáng sợ thật.<br>Nhưng giờ đầu anh ấy ở trên đầu mọi người rồi.,26
112,Tôi muốn mọi thứ về Kim Soo-hyun bị phơi bày hoàn toàn và vứt vào thùng rác.,21
113,"Chắc Kim Soo-hyun cũng phải sởn da gà nhỉ Đang lúc phim đóng cùng Kim Ji-won nổi như cồn thì tự nhiên đăng ảnh chụp chung lên story làm hình tượng kỳ quặc đi, ngày đáng lẽ phải được chúc phúc thì lại chết không kịp trăn trối .. Nếu là tôi thì tôi cũng sợ đến mức không dám đi đám tang và thấy sởn cả gai ốc ấy chứ, mức độ ám ảnh đúng là quá đáng ..",86
114,Kim Se-eui không tung tin nếu không có bằng chứng xác thực. <br>Không phải tự nhiên mà anh ấy được gọi là Kim Fact.<br>Lần này lại một lần nữa tôi phải ngạc nhiên.,46
115,Anh Su-hyeon thật xấu xí.,9
116,"Đồ không có lương tâm, đến trẻ con cũng không tha.",14
117,"Không phải tiền bạc quan trọng, mà là cái chết cần thiết... Tế thần bằng người...",22
118,Đúng là MBC cũng không được bình thường khi tập hợp mọi người lại để tổ chức cái party đó.,21
119,"Nhẹ tay thôi.<br>Kiếm bao nhiêu tiền rồi còn gì,<br>Gánh nặng tâm lý với đứa trẻ con lớn cỡ nào chứ.<br>Tch tch.",40
120,"Xin thành kính phân ưu. Lời kêu cứu ""Xin hãy cứu tôi"" khiến nỗi buồn ập đến. Kim Soo Hyun, quá thất vọng, thất vọng quá.",35
121,Cảm ơn và ủng hộ bạn.,7
122,Đã trao trinh tiết rồi mà đến đám tang cũng không thèm đến Panty Soo Hyun tự kiểm điểm đi,21
123,"Thật đáng thương... Một đứa trẻ có thể lớn lên khỏe mạnh và làm những gì mình muốn, nhưng không ai bảo vệ được em cả.",34
124,"Hả... Cứ tưởng còn trẻ, ai ngờ toàn làm trò của mấy ông chú. Ghê tởm...",23
125,Giá mà có ai đó giúp đỡ thì tốt...<br>Thương quá đi mất<br>Nghe hàng xóm nói đã khóc rất nhiều ở cầu thang...,36
126,Wow... Kim Soo-hyun... vụ này phải ra tòa thôi.,17
127,"Không cần biết những chuyện khác, có người đã chết rồi Su-hyun ơi, trên đời này ㅡㅡ Không thể tin được!!!!",31
128,Thật đáng thương.,4
129,Hoan hô chú!,4
130,"Anh ta đã nói dối. Anh ta gặp cô ấy khi cô ấy 15 tuổi. Nếu không có chuyện tình cảm, làm sao Kim Soo-hyun có thể thuyết phục Kim Sae-ron đổi công ty để đến làm việc cho công ty của anh ta trước?",56
131,Không có sub Indo à,6
132,Tôi lạc đường ở đây mất rồi,7
133,"Sau khi đến công ty của Kim Soo Hyun, Kim Sae Ron đã không thể đảm nhận vai trò mình mong muốn như ở công ty cũ. Khi sự cố xảy ra, công ty đã không giúp đỡ giới truyền thông, phớt lờ cô ấy, đàn áp và cố gắng kiện cô ấy.",62
134,"""가로새로 감사"" đã bị đổi thành ""간사"". Xin đính chính lại.",22
135,"Garo Sero, cảm ơn. Nếu không thì có lẽ đã mất đi một bảo vật đáng tiếc là nữ diễn viên tài năng Sae Ron mà không hề hay biết. Phải nuôi dưỡng nhân tài chứ, sao lại giết người?",49
136,"Ăn đã đời rồi vứt đi, ghê thật...",11
137,Tôi xin chia buồn sâu sắc đến người đã khuất. Cần phải làm sáng tỏ mối quan hệ với Kim Soo-hyun cảnh sát nên điều tra. Moon Hyung-bae! Chuyện em vợ với nhau... Thật không còn gì để nói. Một người như vậy lại là thẩm phán tòa án hiến pháp. Người này lại phán xét về luận tội tổng thống. Thật là tức giận.,82
138,Nếu hẹn hò 6 năm rồi chia tay thì<br>Có phải nên trả tiền bồi thường không<br>Người yêu cũ phớt lờ lời cầu xin tha thiết vì quá khó khăn<br>Đúng là kẻ máu lạnh<br><br>Đã phải<br>Oan ức đến mức nào mà lại rời xa vào ngày sinh nhật người yêu cũ như vậy<br>Xin chia buồn sâu sắc với người đã khuất,93
139,"Cô ấy đang nói gì vậy, làm ơn dịch giúp tôi với",14
140,"Gada sub Indo, không hiểu gì cả",9
141,Tại sao... lại không nộp vậy... Hèn chi người không có tiền thì có tội.,20
142,Chắc Kim Sae Ron sợ bị chửi rủa nên đợi đến tận 1 năm sau khi mọi chuyện lắng xuống mới gửi thông báo chính thức... Đúng như dự đoán.,35
143,Bạn làm ơn thêm phụ đề tiếng Indonesia vào nhé.,12
144,Mở được mật khẩu iPhone á??,8
145,Bí mật vĩ đại điệp viên Bắc Hàn! Con rối của tư bản Trung Quốc cảnh sát kỳ cựu Quan hệ với người chưa thành niên và người nổi tiếng mới Tả phái nhưng dễ thương chỉ là concept Luật sư LKB Lee Kwang-beom,50
146,Không phải Bệ Hạ mà là Bác bỏ. Cái lũ kêu Bệ Hạ cũng là lũ rác rưởi. Hãy hô vang Bác bỏ đi.,30
147,"Tôi đến từ Maroc và người Maroc cảm thấy thương xót cho cô gái đó, đồng thời mong muốn công lý được thực thi cho người đã không được sống một cuộc đời trọn vẹn. Nữ diễn viên đó phải bị trừng phạt. Tôi mong bạn sẽ thêm bản dịch vào video.",57
