ID,Comment Text,Token Count
2230,À...thật á?;;; Đúng là социопат kẻ chống đối xã hội rồi... Tưởng chỉ là người xấu thôi chứ ..;;; Tớ còn tưởng Kim Soo Hyun đã đến cả nhà tang lễ chứ ..<br>Trời ơi;;; Tội phạm này còn đáng sợ hơn cả Go Young Wook nữa;;; Đến mức Lee Soo trông như thiên thần luôn ấy,87
2231,"Chẳng lẽ Kim Ji Won cũng bị lừa rồi sao,,",12
2232,Chắc chẳng ai quan tâm đâu haha.,9
2233,Không thể tin được. Kim Soo Hyun thật thiếu ý thức.,13
2234,Và xem ra bây giờ chẳng phải vẫn đối xử như vậy với gà nhà hay chỉ một người thôi sao? Đừng để chuyện này xảy ra nữa.,30
2235,"Không thể nào chấp nhận được cái kiểu nói ""sao lại có thể như vậy từ phía họ"" khi cháu tôi đã phải lìa đời vì một chuyện oan ức như thế này... Làm sao có thể bênh vực những kẻ đã phủ nhận, sỉ nhục và phỉ báng toàn bộ con người cháu tôi như vậy chứ...? Dù có bị dụ dỗ thế nào đi nữa cũng phải kiên quyết đến cùng, không thể để đứa trẻ đáng thương phải chết oan thêm lần nữa",95
2236,Ý là... việc dì gọi điện thoại có hơi kỳ lạ.,13
2237,Thật ghê tởm khi hẹn hò từ năm 15 tuổi rồi chia tay ngay khi vừa tròn tuổi trưởng thành...... Đây là tội ác.,28
2238,Mong Won Bin báo thù... như trong phim ấy...,12
2239,Jeon Ji-hyun là người Hoa kiều.,10
2240,"Kim Soo-hyun đúng là huyền thoại, nhưng mà thôi đi xuống địa ngục đi;;;; Lần này làm quá đáng thật rồi đó",31
2241,"Có lẽ vì ""chim bé"" nên mới trở thành kẻ ấu dâm.",15
2242,Kim Soo Hyun là một kẻ ấu dâm. Hãy tẩy chay người đó đi.,16
2243,Kim Sae Ron còn quá trẻ... Thật đáng thương,11
2244,Cho xin link Conisha với ạ.,8
2245,"Bạn có thể tìm thấy các sản phẩm bán chạy nhất của [Konisha], thương hiệu chăm sóc da số 1 chuyên về dưỡng ẩm, với mức giá ""siêu đặc biệt Gaseyeon"". Khi mua hàng tại ""liên kết dành riêng cho Gaseyeon"" của Naver Smart Store, hãy nhớ chọn bộ bạn muốn trong số 5 bộ nhé!!",80
2246,"Anh Kim Soo Hyun, nhanh chóng đưa ra bằng chứng để chứng minh sự vô tội của mình đi!! Anh nói sẽ có hành động pháp lý mạnh mẽ mà.",34
2247,Chắc hẳn là rất sợ khi còn nhỏ tuổi mà phải đối mặt với các hành động pháp lý.,20
2248,"Điên thật rồi; 27 tuổi hẹn hò với 20 tuổi thì người xung quanh còn can ngăn, đằng này lại đi với học sinh cấp 2 15 tuổi Thằng ái nhi bệnh hoạn এতদিন동안 giả vờ đoan chính rồi đóng phim truyền hình, điện ảnh, quảng cáo, thành tài phiệt luôn ghê.",72
2249,"Nếu sau khi trưởng thành mà hẹn hò thì dù có chênh lệch tuổi tác, người ngoài có nói ra nói vào cũng không có quyền công khai chỉ trích. Nhưng nếu là vị thành niên thì lại là một vấn đề khác. Phải theo dõi thêm mới biết được. Nếu là sự thật thì Kim Soo Hyun coi như xong, không sống nổi ở Hàn Quốc đâu, phải di dân thôi.",83
2250,"Chúc một ngày tốt lành. Hãy dừng lại. Dừng mọi hoạt động hẹn hò. Sống âm thầm sám hối với Sae Ron, người đã lìa bỏ thế gian một cách đáng thương.",39
2251,Chắc giờ đang bận điên cuồng để mà thao túng bằng tiền từ phía sau...,16
2252,"Đến mức này rồi thì không còn là chuyện có thể giải quyết bằng tiền nữa. Một trong hai người, Gaseyeon hoặc Kim Soo-hyun, chắc chắn sẽ tiêu đời.",39
2253,"Có nhiều tiền mà giúp Kim Sae Ron quay lại rồi chia tay êm đẹp thì Sae Ron cũng sống tốt còn Kim Soo Hyun thì tiếp tục thành công vang dội rồi, đáng tiếc là sao lại đưa ra lựa chọn như vậy.",50
2254,Thật đáng tiếc. Sao có thể hủy hoại cả cuộc đời của một người như vậy sau khi dẫn theo cả trẻ vị thành niên đến lợi dụng chứ. Không thể tha thứ được.,39
2255,Tôi thực sự rất mong chờ Kim Soo-hyun sẽ bào chữa thế nào đấy Chắc lại bảo là có gì dính trên má rồi phủi hộ bằng miệng à?? Còn cái thư bảo đảm kia thì bảo là do con mèo nhà gửi nhầm ấy mà,50
2256,Không lẽ lại là học sinh cấp 2... Điên rồi à.,14
2257,"Yêu nhau 6 năm trời... Dù có say nắng ai đi nữa thì cũng phải... Ít nhất cũng nên gửi vòng hoa đến đám tang, đó là đạo lý tối thiểu của một con người mà?",45
2258,"Công ty quản lý gửi vòng hoa, nhưng nếu có lương tâm thì phải đích thân đến viếng chứ.",21
2259,"Kim Soo Hyun ấy, lẽ ra phải gửi vòng hoa riêng chứ không phải công ty quản lý gửi",21
2260,Tại sao Kim Soo Hyun không đưa ra tuyên bố gì vậy? Chẳng lẽ lại chẳng khác gì Moon Hyung Bae sao?.,28
2261,"Công ty quản lý làm mà! Toàn tin sai sự thật thôi, bên nào đúng thì sẽ giải quyết bằng pháp luật.",26
2262,"6 năm trời hẹn hò với trẻ vị thành niên... Rồi một ngày đẹp trời thuê hẳn 3 luật sư đến đòi tiền, bản thân thì cắt đứt liên lạc... Cái này chẳng phải là đồ tồi tệ sao.",47
2263,"Bắt người ta làm việc mà không trả lương đàng hoàng, lại còn đòi tiền phạt với tiền bồi thường thiệt hại các kiểu. Chắc lo sợ hình ảnh bản thân bị ảnh hưởng nếu không giữ khoảng cách sau khi uống rượu hả? Dù không có nghĩa vụ phải trả nợ nhưng ít nhất cũng đừng có mà ăn chặn tiền công của người ta chứ. Cứ ra vẻ phân biệt công tư các kiểu mà lại hành xử như vậy? Đúng là mạt thế rồi, mạt thế...",100
2264,Đúng là đồ 망나니 mangnani mà Đúng là đồ 망나니,16
2265,Đồ côn đồ.,4
2266,"Đỉnh của đỉnh, thật sự.",9
2267,[] Cười ỉa,4
2268,Liệu có phải anh ta chỉ hẹn hò với Kim Sae-ron trong 6 năm không?? Chắc hẳn nhiều nữ nghệ sĩ khác cũng bị anh ta chơi xỏ sau lưng rồi.,38
2269,"Chắc cũng hẹn hò vài năm với Ahn Sohee, bắt cá hai tay haha.",19
2270,"Chắc là chơi bời với mấy đứa trẻ con. Chẳng phải là kiểu một người anh thành đạt tán tỉnh thì mấy cô kia mừng húm, chỉ cần được gặp là cảm kích lắm rồi, một mối quan hệ không hề bình đẳng hay sao? Mấy cô gái thì tự huyễn hoặc mình đang hẹn hò, còn Kim Soo Hyun thì lợi dụng chuyện đó... ha.",77
2271,Ái quốc ca là cánh hữu á hả? À không,11
2272,"Ghê tởm thật sự, thấy khó chịu trong người. Cứ tỏ vẻ thanh cao một mình, hóa ra lại là kẻ ấu dâm. Hết nói.",35
2273,Thật sự là... có nhiều người đáng sợ thật......<br>Các người đang sống cuộc đời như thế nào vậy......,28
2274,Việc bạn trai cũ qua đời vào đúng ngày sinh nhật là điều lạnh lẽo đến mức đóng băng... Công chúng đã quay lưng và chỉ còn lại những lời nguyền rủa...,36
2275,Bạn chưa đọc nội dung à?,7
2276,Nhìn Kim Sae Ron cầu xin kìa... Ha...,12
2277,Chắc là Sae Ron đã nguyền rủa rồi chết.,11
2278,"Chắc chắn sắp tới sẽ sang Trung Quốc và đóng phim cổ trang Trung Quốc, tôi đặt 100 phiếu cho điều đó haha.",27
2279,"Cô ơi, có khi nào cô bị dụ dỗ hay đe dọa không đấy?? ??? Sao tự nhiên lại ""cũng có thể như vậy mà,,,"" chứ???? Bàng hoàng quá đi mất;;;; Giờ chắc Sae Ron đang lang thang ở tận trời xanh khóc ròng đấy cô ơi!!! Tỉnh táo lại đi cô",81
2280,Thật sự là quá thất vọng. Rút kiếm ra rồi thì phải chiến đấu đến cùng chứ. Cứ như quả bóng xì hơi ấy.,27
2281,"Vụ này xảy ra rồi bị công khai hóa thì chắc sợ lắm... Chắc đã nhận vô số cuộc gọi... Có thể đã bị fan hâm mộ đe dọa... Bản thân không khỏe mạnh gì, còn có cả gia đình nữa... Hơn nữa lại còn là đối tượng giàu có nữa chứ;; Nếu bị kiện thì cá nhân không thể nào gánh nổi;;",84
2282,Kim Soo Hyun nổi da gà thật đấy............,11
2283,Những điều tốt đẹp mà mọi người biết về bạn đều do công ty dựng lên.,17
2284,Nhưng tại sao không ngăn cản hai người họ gặp nhau? Là không biết rồi sau đó mới biết ạ? Hoàn toàn không hiểu gì cả.,30
2285,Đương nhiên là bác bỏ luận tội để bảo vệ nền dân chủ tự do.,16
2286,"Thất vọng thật sự... Không phải là người nữa rồi... Đúng là Kim Soo Hyun... Thật sự giới giải trí đáng sợ thật đáng sợ. Sae Ron à, mong em yên nghỉ ở trên trời.",45
2287,Vớ vẩn. Gia đình thì liên quan gì?,13
2288,"Vì đây là nền dân chủ theo thủ tục, nên kiến nghị luận tội phải bị bác bỏ. Tôi hiểu rồi.",26
2289,Chắc là quan hệ yêu đương nên mới nói trống không... Lục lại lịch sử điện thoại là biết ngay ấy mà. Kim Soo Hyun xuống dốc,30
2290,Kim Soo Hyun... điên mất thôi.,8
2291,"Gaseyeon, cố lên!<br>Luôn ủng hộ các bạn.<br><br>Lee Jin Ho, Kang Kyung Yoon phải trả giá cho tội ác của mình<br>Mong là sẽ sụp đổ.",49
2292,Tôi thực sự không muốn nhìn thấy Kim Soo Hyun.,11
2293,Wow... Tôi không nghĩ một người có thể viết bình luận như vậy. Người này có còn là con người không vậy...,27
2294,"Nhìn ảnh Kim Soo Hyun hồi nhỏ đặc biệt được yêu thích ở Trung Quốc, có cảm giác như người Trung Quốc. Nam nữ chính của ""Vì sao đưa anh tới"" đặc biệt nổi tiếng ở Trung Quốc là Kim Soo Hyun và Jeon Ji Hyun.",55
2295,"Thật sự là Sae Ron đáng thương quá, hãy cứu sống lại đi.",16
2296,"Chắc là chỉ chơi bời rồi vứt bỏ thôi. Haizzz, rồi lại đi gặp người phụ nữ khác ngay thì thật là độc ác.",29
2297,"Kim Soo Hyun điên rồi à? Như vậy mà còn đòi kiện tụng pháp lý!!! Cứ như thể quen từ khi là người trưởng thành ấy. Coi công chúng như cứt dưới chân vậy, thật là hết nói nổi, nên cho cút khỏi giới giải trí đi.",58
2298,"Chắc hẳn việc hẹn hò với Saeron từ khi còn vị thành niên là một điểm yếu lớn đối với anh ta, nếu là tôi thì có nhiều tiền như vậy, tôi sẽ đưa 700 triệu won rồi dứt khoát cắt đứt quan hệ. Yêu nhau lâu năm, lại còn giúp đỡ công việc của công ty quản lý mà anh ta lại phát điên vì tiền đến mức đẩy người ta vào chỗ chết sao, phải cho xuống địa ngục thôi.",90
2299,Hoàn toàn đồng cảm...,6
2300,ㅉㅉ đáng khinh,4
2301,"Đừng có xúc phạm người đã khuất và gia quyến chỉ vì một nam diễn viên mà bạn thậm chí còn chẳng biết mặt, hãy sống như một con người đi.",34
2302,Sao chuyện này không được đưa tin rầm rộ ở Hàn Quốc nhỉ.,15
2303,"""Rame"" có thể mang nhiều nghĩa tùy theo ngữ cảnh. Bạn có thể cung cấp thêm ngữ cảnh để tôi dịch chính xác hơn không?",32
2304,Hắn ta đã kiểm soát rất nhiều kênh truyền thông bằng tiền. Xin hãy cho nhiều người ở nước ngoài biết điều này.,25
2305,Đây là yêu hay là đáng sợ.,8
2306,"Đm, ăn 30 tuổi rồi còn đi quen vị thành niên à.",15
2307,Kim Soo-hyun bị loại rồi.,9
2308,Kim Soo Hyun ㅅㅂ từ chửi thề,8
2309,"Tôi thấy quảng cáo Homeplus, hãy trả tiền phạt vi phạm hợp đồng và giúp Homeplus đi.",21
2310,"Hình như Homeplus phá sản nên không cần trả phí vi phạm hợp đồng. Đúng là thời điểm tốt, có cả vận may giúp đỡ nữa.",31
2311,"Thật đau lòng và phẫn nộ tột độ. Đúng là lũ quỷ đội lốt người. Ở cái tuổi đó, em đã sợ hãi đến mức nào chứ.",32
2312,"Ai là người có sức ảnh hưởng am hiểu vấn đề này, hãy thảo luận cặn kẽ mọi thứ đi, tôi không hiểu gì cả.",28
2313,"Ánh mắt Kim Soo-hyun kìa, đúng là ác quỷ. Mắt một mí đầy độc địa.",22
2314,"Dù người nhà có đưa tiền ra để thỏa thuận thì cũng đừng đồng ý, cứ lờ họ đi thì càng tốt. Hãy tiếp tục đưa ra những bằng chứng xác thực. Đó là cách để không giết người thêm lần nữa.",48
2315,Đúng như tôi nghĩ,4
2316,Ước gì bạn kiện mấy đứa chửi rủa gia quyến người ta rồi nhận tiền hòa giải ngọt xớt.,22
2317,"Gia quyến à, những kẻ đó là lũ lợi dụng lòng tốt đấy. Xin đừng mắc lừa cái lời dối trá rằng chúng không ổn định về tâm lý. Xin hãy trừng trị bọn người đó đến cùng.",43
2318,Điên mất 김수현,6
2319,"Ghê tởm vãi, đến tè bậy bên đó cũng không được",15
2320,Vậy nên mới xuất hiện trên các chương trình giải trí hả!!!??,17
2321,Phải chôn vùi thôi. Bây giờ mới biết lý do Kim Sae Ron tự tử vào ngày sinh nhật Kim Soo Hyun. Tuổi còn trẻ mà đã bị vứt bỏ... Đến mức tự tử. Tệ thật.,43
2322,Càng nghĩ đến việc bọn đó kiếm đủ tiền rồi càng thấy ức chế.,15
2323,Hiểu gì không mọi người?,7
2324,"Gia đình diễn viên Kim Sae Ron cố lên nhé. Tuyệt đối đừng có suy nghĩ tiêu cực, hãy cố gắng giữ vững tinh thần và nghĩ về diễn viên Kim Sae Ron đã ra đi để mạnh mẽ hơn nhé.",50
2325,Nhân cách tệ hại. Mong là đi đường này sẽ xuống địa ngục.,15
2326,Kim Soo Hyun đúng là một tên khốn.,10
2327,"Điên rồi, là người à?",10
2328,Sao dì lại không nhiệt tình nhỉ...<br>Trông có vẻ khó chịu,17
2329,Chắc là bạn mệt mỏi rồi...,9
2330,"Về mặt đạo đức mà nói, hẹn hò với một đứa trẻ 15 tuổi đã là không bình thường rồi...<br>15 tuổi là học sinh cấp 2 hoặc mới tốt nghiệp tiểu học.",42
2331,Nụ cười của Kim Soo Hyun toàn là giả tạo...........,13
2332,20 tuổi vẫn còn là trẻ con mà... Xin thành kính phân ưu.,15
2333,Bẩn thỉu.,5
2334,"Đứa trẻ nhỏ có bao nhiêu uất ức và hận thù mà lại tự tử vào ngày sinh nhật Kim Soo Hyun chứ Cái loại thối tha trơ trẽn không có lương tâm mà đến giờ vẫn chưa tỉnh ngộ. Chắc vì có nhiều tiền nên không sợ gì, xung quanh có cả đống rác rưởi như Lee Jin Ho hay lũ báo chí bẩn bảo vệ cho. Cầu mong trời phạt hắn.",81
2335,Định nghĩa của việc trả giá bằng sự ra đi là gì? Nhưng nó quá đau đớn và cuối cùng đã chọn ngày sinh nhật của Kim soo hyun.,33
2336,Hãy tiếp tục phơi bày sự thật.,8
2337,"Nhìn đám báo chí lá cải không dám hé răng nửa lời, có vẻ như chế độ độc tài là do lũ hề hước, nghệ sĩ và luật sư đắt tiền tạo ra thì phải? Tổng thống với phu nhân thì cứ chửi bới thoải mái, còn mấy ngôi sao tài phiệt thì sợ xanh mắt không dám nói gì à?",71
2338,...Sởn cả da gà... Bình thường tôi không bình luận đâu nhưng mà sốc với sởn da gà quá nên phải viết.,26
2339,"Tên này là một kẻ thái nhân cách, chứng minh rằng con người còn đáng sợ hơn cả ma quỷ.",23
2340,"Tôi không có thiện cảm với Kaseyeon, nhưng lần này tôi thực sự cổ vũ họ. Xin hãy giải tỏa nỗi oan khuất của nữ diễn viên Kim Sae Ron, người đã chết một cách oan ức. Gia đình có lẽ đang rất bàng hoàng và mệt mỏi với tình hình hiện tại, đến mức không còn sức để chiến đấu. Nhưng một lời nói của Kim Se-eui rằng anh ấy sẽ thay mặt gia đình chiến đấu khiến tôi thực sự muốn cổ vũ anh ấy. Tôi không phải là fan của Kim Sae Ron hay Kim Soo Hyun. Nhưng Kim Soo Hyun, người chỉ có khuôn mặt đẹp mà không có chút đạo đức làm người nào, thật là rác rưởi. Sống rồi mới thấy có nhân quả báo ứng. Anh đã kiếm đủ rồi thì hãy rời khỏi giới giải trí đi. Anh nên có sự quan tâm tối thiểu đến người yêu cũ Kim Sae Ron chứ. Mọi chuyện đã bị phơi bày đến mức này rồi thì đây chắc chắn là sự thật. Anh định che giấu sự thật bằng cái gì? Chắc hẳn nữ diễn viên Kim Sae Ron không thể nhắm mắt xuôi tay ngay cả khi đã chết.",239
2341,"Các phương tiện truyền thông cũ đang cố gắng đẩy GaSeYeon Kaseyeon vào thế xấu. Trên thực tế, họ luôn đưa tin trung thực dựa trên sự thật đôi khi Seui hyung hơi nóng tính, mong mọi người thông cảm bỏ qua cho ảnh nhé. haha",59
2342,"Không, bây giờ tôi vẫn không nhìn nhận cô ấy tốt, nhưng kỳ lạ là tôi lại cổ vũ cho vụ của diễn viên Kim Sae Ron lần này. Có lẽ cô ấy đã có thể sống tiếp, nhưng cái gã người yêu cũ kia sao lại có thể không có chút tình người nào vậy. Có vẻ như cô ấy đã hoàn toàn sụp đổ vì nội dung chứng minh và thái độ của người yêu cũ trong một tình huống bi thảm. Tôi sẽ không thích Gaseyeon đâu!! Nhưng tôi hy vọng diễn viên Kim Sae Ron sẽ cho chúng ta thấy điều gì đó. Có vẻ như chỉ có Gaseyeon mới có thể làm được điều này. Thật trớ trêu thay.",146
2343,Nhớ đến Sulli và Choiza ghê... Có vẻ như con gái mà yêu đương như người lớn khi còn quá trẻ thì không tốt cho não bộ...,31
2344,Nghĩ đến tình xưa nghĩa cũ thì cho luôn 700 triệu đi.,13
2345,"Tôi vừa xem livestream của một YouTuber, người này nói đó không phải là việc của họ và họ không quan tâm vì đó là vấn đề riêng tư cá nhân. Nhưng không phải vậy chứ. Lạm dụng tình dục trẻ vị thành niên là một tội ác lớn, nếu nói ""Tôi không quan tâm vì đó không phải là việc của tôi"" thì khác gì người Trung Quốc. Tôi thấy tiếc cho Kim Sae Ron.",89
2346,Tôi không hiểu.,4
2347,Cảm ơn bạn vì đã cho tôi biết sự thật.,11
2348,Linuui là thương hiệu do Shim Madam tạo ra.,14
2349,Trời ơi phải làm sao đây...,8
2350,"Tôi không nghĩ dì Kim Sae Ron lại là người bán cháu mình đã khuất để nói dối đâu....<br>Cháu đã chết rồi, giờ thì liều mình chấp nhận bị kiện, báo cho giới truyền thông nhưng không được nên mới tìm đến 가세연 Gaseyeon thì... haizz....<br>Mà 가세연 Gaseyeon không có chứng cứ xác thực thì không hành động đâu, vậy mà đích thân ra mặt thì...<br>Đúng là đã có được chứng cứ xác thực như trong video rồi. Người đã khuất... Nếu lúc còn sống, trước khi chết, nhờ dì giúp đỡ thì... Tôi nghĩ có lẽ đã khác. Chắc hẳn đã rất khó khăn và đau khổ nên mới lựa chọn cực đoan như vậy.... Cầu nguyện cho người đã khuất.",171
2351,"Nếu Kim Soo Hyun thấy ức, thì hãy chứng minh sự vô tội của mình trước những bằng chứng mà Kaseyeon đưa ra. Có vậy thì mới có người tin. Cứ khăng khăng kiện cáo thì chỉ phản tác dụng thôi... Dù sao thì tôi cũng đã xem video rồi, giờ tôi muốn xem chứng minh của Kim Soo Hyun. Người ta vẫn bảo là đừng chỉ nghe mỗi lời một bên mà phải nghe cả hai bên. Nếu bản thân thực sự vô tội thì hãy chứng minh đi.",106
2352,"Nếu dì nói dối, kết quả hiển nhiên là dì sẽ bị công chúng chỉ trích là một ác nữ lợi dụng cháu mình để kinh doanh. Nếu đó là lời nói dối, dì phải trả giá.",46
2353,Nhưng mà làm thế nào mà mọi người lại khẳng định chắc nịch ảnh hôn kia là chụp hồi cấp 2 vậy?,24
2354,Chào bạn Kim Soo Hyun,5
2355,Không biết ở nhà được dạy dỗ kiểu gì mà lại có suy nghĩ đó? Không hẹn hò thì mới là vấn đề đó,25
2356,Tôi không hiểu ngôn ngữ này.,7
2357,"Kim Sae Ron chắc hẳn đã rất đau đớn và mệt mỏi, tôi xin lỗi vì đã hiểu lầm em dù chỉ là nhất thời. Tôi rất đau lòng. Tôi hy vọng những người đã làm em đau khổ sẽ bị trừng phạt.",50
2358,"Thật là vớ vẩn Nếu đã như vậy thì cho 700 triệu won làm gì…??? Nếu không có anh thì tự lo liệu được, sao lại dồn người ta vào đường cùng? Hẹn hò 6 năm rồi mà bảo là gặp nhau bằng tình yêu thật lòng á? Ghê tởm, như thằng điên ấy, cứ làm như không biết thì hơn, sao lại ra mặt hành hạ người ta chứ, thật sự sống trên đời chưa bao giờ thấy ghét một người như vậy ;",104
2359,"Điên thật, sốc quá. Kim Soo Hyun tệ nhất.",14
2360,"Nếu đó là sự thật... thì không biết chừng đó là mối tình đầu, 6 năm thì có lẽ là cả thế giới của cô ấy... Người như vậy mà lại trở nên như thế thì trái tim người con gái chắc hẳn đã tan nát đến tận cùng... Người trưởng thành chia tay còn thấy khó khăn nữa là. Đã không thể an ủi được trong lúc khó khăn thì ít nhất cũng nên để yên chứ...",88
2361,"Dù sao thì cũng đã cố gắng chịu đựng rất tốt rồi... Thông báo pháp lý, rồi cả số điện thoại cho phóng viên... Cảm giác bị phản bội sau tất cả.",39
2362,"崔子 và Sulli gặp nhau lần đầu khi cô ấy còn vị thành niên. Với một cô gái trẻ, mối tình đầu là tất cả đối với cô ấy. Sulli không thể không sụp đổ.",41
2363,Thật đáng tiếc,3
2364,"Ghê tởm thật sự. Một người trưởng thành mà lại nghĩ đến việc yêu đương với trẻ vị thành niên đã là nực cười rồi, còn kiện tụng nữa chứ, đúng là hết chỗ nói. Càng biết về đời tư thì càng thấy ghê tởm.",55
2365,"Nếu mà gặp nhau hồi 16 tuổi thì chắc hẳn là mình đã cảm nhận được một cái gì đó còn hơn cả bạn trai, kiểu như một người lớn, một người bố để mình nương tựa ấy, nên chắc đã dựa dẫm vào người ta nhiều lắm. Lại còn cùng nhau diễn xuất nữa nên về mặt tinh thần chắc hẳn là một người có vị trí rất lớn.",79
2366,"Một diễn viên trẻ còn chưa kịp nở đã qua đời, lại còn đúng vào ngày sinh nhật nữa. Chuyện này không nên xảy ra.",29
2367,"Đương nhiên, lái xe khi say rượu là phạm tội, nhưng việc mọi người chửi rủa và chế nhạo người này thậm tệ hơn những diễn viên khác cho đến tận bây giờ, rồi giờ dư luận mới thay đổi... thật đáng tiếc... và tôi thấy thật sự chán ghét. Diễn viên từng dùng ma túy thì vẫn nổi như cồn với vai chính... vân vân... Haizz...",85
2368,Quá đáng thật sự...,5
2369,"Chắc chỉ là 700 triệu won đối với Kim Soo Hyun thôi mà... Chỉ cần nói một câu ""Cứ trả từ từ thôi cũng được""... Đáng thương thật.",33
2370,"Nghe nói là người của công chúng, những vụ việc như này cần phải làm rõ sự thật.",21
2371,"Anh ta thật sự là người hai mặt, tôi đã nghĩ anh ta là người tốt. Cố lên Kim Sae Ron",25
2372,"Ngôi sao vào tù vì tội lạm dụng trẻ vị thành niên ở Trung Quốc nói rằng ""Không có bông tuyết nào là thuần khiết cả"". Kim Soo Hyun điên thật rồi.",37
2373,"Hai Kwon, tỉnh táo lại đi.",9
2374,Thấy Lee Jin Ho bênh vực Jung Woo Sung là tôi bỏ theo dõi luôn,15
2375,Chắc điện thoại của Sae Ron có nhiều ảnh lắm nhỉ. Đau lòng thật nhưng mong là những bức ảnh đó cũng được công khai ra thế giới. Mong cô ta bị trừng phạt nghiêm khắc.,42
2376,Chúc Soomen chóng khỏe nhé.,10
2377,"Không thể tin được, là học sinh cấp 2!",11
2378,"Đừng chết và hãy vạch trần tất cả đi. Sae Ron quá đáng thương. Nếu điều này là sự thật, các tiền bối diễn viên phải giải oan cho Sae Ron chứ.",39
2379,Dù không phải là người yêu thì Kim Soo Hyun cũng quá tàn nhẫn... bắt trả ngay 700 triệu won... rồi còn đưa số điện thoại của chị họ Kim Sae Ron cho phóng viên... Quá ác độc... vốn dĩ là người như vậy sao... đáng sợ thật...,60
