ID,Comment Text,Token Count
1628,Wow... Không còn gì để nói. Với tư cách là một người hâm mộ đã thích cả hai người....,24
1629,Chắc là Sae Ron không liên lạc được với Kim Soo Hyun nên mới đăng ảnh đôi. Đăng ảnh đôi để xem người ta có liên lạc với mình không ấy mà... Chắc cô ấy cũng yếu lòng nên mới không công khai được thư xin lỗi.,51
1630,"Nếu Kim Soo-hyun là người sẽ đau lòng mỗi dịp sinh nhật vì vụ tự sát của Kim Sae-ron, thì ngay từ đầu đã không hẹn hò với trẻ 15 tuổi? Không gửi giấy báo 700 triệu won?... Kim Soo-hyun là người không biết cảm thấy tội lỗi... Chỉ người chết là đáng thương thôi.",69
1631,"Chắc là hoặc là thái nhân cách, hoặc là người chống đối xã hội.",16
1632,"Ý kiến của bạn cũng đúng, nhưng cuối cùng người đẩy cô ấy đến cái chết vẫn là Kim Soo Hyun. haha",26
1633,"Việc hẹn hò ở tuổi vị thành niên mang tính lệ thuộc cao, nếu chia tay thì Kim Sae Ron hẳn đã rất khó khăn. Công ty quản lý cũng là cùng một chỗ, hẳn là đã chật vật với rượu rồi ra nông nỗi này.",53
1634,"Ông chú à, việc người vị thành niên và người trưởng thành hẹn hò là phạm tội đấy, bênh vực thì cũng phải lựa cái mà bênh chứ.",32
1635,Chắc phải đeo vòng chân điện tử rồi? Nếu là ở Mỹ thì 15 tuổi là án chung thân đấy.,24
1636,Thằng nào mà cuối 20 hẹn hò với học sinh cấp 2 thì đúng là thằng điên.,18
1637,"Hồi cấp 2, mình còn phải nhờ bố mẹ kiểm tra bài tập, đưa đón đến lớp học thêm, chẳng làm được gì một mình, đúng kiểu trẻ con ấy;;;",40
1638,Anh Kim Soo Hyun người Hàn Quốc ơi Bây giờ anh có thời gian cho hội 88 trai Hàn không? Chuyện anh không đi viếng mà lo PR là thật hả? Chuyện anh trả lời phỏng vấn muốn kết hôn với người 21 tuổi ở tuổi 41 là thật hả? Bỗng dưng tôi sẽ không thể quên ngày sinh nhật của Kim Soo Hyun mất Trai Hàn ăn xong bỏ rơi trẻ vị thành niên ở độ tuổi 30 không phải là chuyện để lên báo sao Anh cứ khăng khăng đó là thông tin sai lệch trông thật đáng xấu hổ Anh lập câu lạc bộ bowling với Go Young Wook đi,120
1639,Kim Soo Hyun đáng sợ thật.,7
1640,"Một người có nhiều tiền lại dùng tiền để hành hạ người yêu cũ như vậy sao... Tôi không thích Kim Sae Ron, nhưng nếu tất cả những điều này là sự thật thì Kim Soo Hyun đúng là... một kẻ xấu xa.",48
1641,Tệ nhất.,3
1642,"Chắc cú thumbnail mạnh nhất từ trước đến nay, đến cả người ủng hộ Lee Jae-myung cũng phải click vào xem.",27
1643,"Kim Soo Hyun đã góp phần giết Kim Sae Ron. Thằng ấu dâm kia sắp vào tù rồi. Bị bắt giam rồi còn làm trò thân Trung Quốc, phải nhận sự trừng phạt của người dân... Phải bị toàn dân xâu xé thì mới biết nỗi đau của Sae Ron... Mày cũng xong rồi, mấy đứa nghệ sĩ chơi với mày hay mấy diễn viên đóng chung phim cũng bị vạ lây thôi. Đáng lẽ phải ác vừa vừa thôi chứ... Đã không để yên cho Sae Ron, lại còn gửi giấy thông báo đòi bồi thường trong khi đáng lẽ phải trả tiền vì tội ấu dâm... Tự đào mồ chôn mình rồi...",136
1644,Chưa xem nhưng chuyện nam nữ chỉ có hai người biết.,12
1645,Vậy người phụ nữ đó không có tội sao? Làm sao cô ta có thể yêu một người lớn tuổi hơn mình? Gia đình cô gái đã đồng ý chuyện này như thế nào? Tại sao chỉ có Kim Soo Hyun phải chịu trách nhiệm?,52
1646,So sánh người chỉ học hết cấp 1 với mấy ông chú U30 á? Định hợp lý hóa bằng cách đặt lên cùng một bàn cân hả? Lố bịch.,37
1647,Giả vờ là người nước ngoài đáng thương ghê.,10
1648,"Tôi nghĩ Lee Jae-myung là đỉnh rồi, ai ngờ còn nhiều người hơn thế nữa! Haizzz",25
1649,"Nợ nần chồng chất, đến công việc cũng mất, đường sống thì mịt mờ, gửi cái thông báo 700 triệu won chẳng khác nào bảo đi chết đi. Về mặt pháp lý thì đúng là hành vi đúng, nhưng người ta cũng không phải là trốn tránh không trả, đã từng là người yêu, quen nhau 6 năm, đến cái mức gia hạn trả nợ đó cũng không thể chiếu cố được thì chắc cũng không phải là không có tiền đến thế đâu, đúng là lạnh lùng thật. Không có trách nhiệm pháp lý, nhưng mà cũng nên có chút trách nhiệm với lương tâm đi.",125
1650,"Nếu mà là sự thật thì nên dừng làm người nổi tiếng thôi, về Trung Quốc nhập tịch hay gì đi, chứ ở Hàn Quốc thì tôi không muốn thấy nữa. Đừng có mà động vào Kim Ji Won... À phải rồi, phải đi tù đã chứ nhỉ.",58
1651,Nếu mà đến cả diễn viên Jiwon mà mọi người tung hô là nữ hoàng chu đáo mà cũng bị động đến thì... Wow Phải tống cổ vào tù thôi.,34
1652,"Tôi không thể tin được rằng Kim Soo Hyun lại là một kẻ tồi tệ như vậy sau cái chết thương tâm của Sae Ron. Mong rằng đó không phải là sự thật. Kim Soo Hyun, hãy giải thích đi. Nếu điều đó là sự thật thì anh nên biến khỏi tất cả các bộ phim và драмы. Anh thậm chí còn không phải là con người. Anh đáng bị loại khỏi giới phát thanh truyền hình.",88
1653,"Tiết kiệm được 700 triệu won, lại bay mất mấy nghìn tỷ won, hahaha.",19
1654,"Tạm biệt Soo-hyun, cuối cùng thì mấy chuyện 88 clb cũng kết thúc rồi.",21
1655,"Những người vốn đã có nhiều thứ lại càng không từ thủ đoạn để có thêm. Những người có lối sống ban phát cho người khác là những người dân thường, và chính vì vậy mà Đại Hàn Dân Quốc này sống được là nhờ những người dân thường.",53
1656,Đến lúc Won Bin xuất hiện rồi. Nhổ hết răng vàng ra và ăn tươi nuốt sống hết bọn chúng đi.,25
1657,Sốc tận óc,3
1658,"Thằng chó yêu nhau 6 năm trời lại gửi thông báo đòi tiền, dù tôi có kêu cứu xin tha cũng không thèm đến đám tang. Thật là bẩn thỉu.",35
1659,"Haizz... Tôi biết rõ giới giải trí dơ bẩn như thế nào, và trong suốt thời gian qua, tôi đã thấy vô số trường hợp người nổi tiếng có vẻ ngoài và con người thật khác nhau như Jung Woo-sung, Jang Dong-gun, Kang Kyung-jun... Những người vẫn còn ảo tưởng về người nổi tiếng có vẻ quá ngây thơ... Thực tế, để sống sót ở đẳng cấp cao nhất trong giới giải trí khắc nghiệt đó, bạn phải là một người cực kỳ độc ác thì mới được Kim Soo-hyun cũng vậy... Anh ta từng có hình ảnh một thanh niên sống đúng mực, nhưng hóa ra lại hẹn hò và thao túng tâm lý trẻ vị thành niên sau lưng...",148
1660,Người ta nói Won Bin chỉ đóng quảng cáo và rời khỏi giới giải trí đều có lý do cả đấy. Dù không nói thẳng ra nhưng ai cũng biết giới giải trí là nơi như thế nên sau khi kết hôn anh ấy chỉ đóng quảng cáo thôi.,51
1661,"Thật lòng mà nói, trong giới cũng không hẳn là hình tượng đúng đắn gì, mà những tranh cãi nổ ra cũng không phải lần đầu, nên trong thời gian qua cũng có không ít người tặc lưỡi cho qua. Lúc nước khoáng Trường Bạch Sơn cũng ồn ào cả lên, mà những tranh cãi nhỏ nhặt cũng không chỉ một hai chuyện, nên việc hình tượng nổi đình nổi đám nhờ ""Good Day"" hay ""Loving You"" thật sự khó hiểu.",98
1662,"Thực tế thì, hình tượng ""học sinh gương mẫu"" có được phần lớn là nhờ vai diễn Lee Hwon trong ""Mặt Trăng Ôm Mặt Trời"". Bản thân Lee Hwon vốn dĩ đã có hình tượng đúng đắn rồi... Vì cậu ấy đã thể hiện vai diễn đó rất tốt...",65
1663,"Có lẽ Kim Sae Ron có bạn trai đầu là anh ấy Ngược lại, cô ấy không tiết lộ sự thật để bảo vệ Kim Soo Hyun. Kim Soo Hyun, anh thật giả tạo, giả tạo trên sóng truyền hình",47
1664,"Nghe nói chú Won Bin đến nhà tang lễ đầu tiên. Vì năm xưa từng cùng nhau đóng phim, thật là một việc đáng quý.",28
1665,"Đúng là ác quỷ mà... Lợi dụng một đứa trẻ ngây thơ, gặp nhau hơn 6 năm rồi mà không có chút tình cảm nào sao, phải làm đến mức này sao? Ít nhất cũng không khác gì tội phạm tình dục.",47
1666,"Đúng vậy, người ta nói rằng phụ nữ ôm hận thì không thể rời khỏi thế gian này. Phải giải tỏa nỗi hận cho họ.",30
1667,Chắc là ấm ức lắm nên mới đi vào đúng ngày sinh nhật người yêu cũ...,17
1668,Trung Quốc còn nghiêm khắc hơn về vấn đề vị thành niên đấy...,15
1669,Nếu đã làm sai thì phải bị chỉ trích.,11
1670,Rợn cả người.,5
1671,Nếu mà là thật thì... đúng là dòng máu không thể giấu được à. Tưởng là số khổ vì có anh em khác mẹ khác cha làm loạn... Cuối cùng thì bản thân cũng...,40
1672,"Chắc hẳn Soo-hyun đã ăn ngon và đi chơi nhiều nhỉ, chắc đã vui vẻ với hàng chục hàng trăm mỹ nữ và những em căng tràn sức sống. Dù có phá sản thì vẫn còn nhiều tiền thôi Cơ mà chắc không dám ngẩng mặt lên nhìn ai đâu nhỉ.",58
1673,Lướt sóng à. Haizzz lại bắt đầu nữa rồi...<br>Người đã khuất thì... đáng tiếc thật... Nhưng mà cái đó là cái đó... Sao lại... Thật đáng tiếc cho mọi người.,47
1674,"Đã làm sai thì phải bị chỉ trích chứ, đồ rác rưởi, bênh vực cái gì ở đây.",23
1675,"Người ta chết rồi mà vẫn ""chuyện đó là chuyện đó""? Đúng là đam mê trai Nam Mỹ dữ dội. haha",27
1676,"Chửi bới người ta xong xuôi, người chết oan thì không sao, còn cái thằng nói dối đẩy cuộc đời người khác xuống địa ngục lại được ăn ngon sống tốt là sao???",40
1677,"Không cần biết những thứ khác,<br>Việc không đến đám tang cho thấy<br>Kim Soo Hyun là thủ phạm.<br>Ít nhất cũng nên đến vì tình bạn trước đây chứ.<br>Kim Soo Hyun, anh không phải là con người,<br>Mà là ""quái vật"".....",70
1678,Loli đến từ các vì sao,7
1679,Cảm ơn vì đã giải oan cho Kim Sae Ron.. Thật đáng tiếc.,16
1680,Ghét cay ghét đắng thằng Kwon Seong-dong. Phải biến mất cùng với Jang Je-won.,21
1681,Thật sự là sốc,4
1682,Wow... đúng là đồ tồi mà... Kim Soo Hyun.,13
1683,Tôi đã rất sốc khi đột nhiên nghe tin bạn gây tai nạn sau khi uống rượu.,18
1684,Chỉ riêng việc hẹn hò với trẻ vị thành niên thôi đã thấy ghê tởm lắm rồi... muốn ói quá đi,25
1685,Ôi trời.,4
1686,Ghê tởm thật sự.,7
1687,Sốc quá.,3
1688,Chắc chắn rồi,3
1689,Vũ khí. Nói xấu sau lưng. Người nổi tiếng.,12
1690,"Đứa bạn gái cũ còn trẻ như vậy, nó đã cầu xin cứu giúp như thế mà không giúp một chút nào... Biết rõ hoàn cảnh khó khăn của nó... Trong các vụ án của giới giải trí, đây là vụ buồn nhất và gây sốc nhất.",54
1691,"Tôi không nghĩ bạn sẽ hiểu nếu tôi giải thích một cách logic, nên tôi chỉ thấy tiếc cho cuộc đời bạn thôi.",26
1692,Chắc hẳn [nạn nhân] chỉ là bằng chứng phải che giấu của tội ác mà hắn gây ra thôi... Thằng khốn nạn.,29
1693,"""Cái con Song Ha Yoon bị đuổi học 2 lần vì bạo lực học đường thời cấp 3 cũng vậy, lũ ác ma sao cứ phải giả nai trên TV thế nhỉ?????""",42
1694,Tôi rất thất vọng về Kim Soo Hyun.,9
1695,"Từ xưa đến nay, bà Shim Madam Linuুই đã nổi tiếng ở khu Gangnam rồi. Người ta còn đồn rằng Go Young-tae thiết kế túi xách cho bà ấy, hay bà ấy có mối quan hệ rộng trong giới giải trí, vân vân.",56
1696,"Chưa hẹn hò mà đã hôn má thì điên hơn không? <br>Điên mất thôi, ông chú gần 40 tuổi rồi còn ㅡㅡ",31
1697,"Cao Young Wook, một thất bại khó hiểu!!",13
1698,Không phải chèn hình mờ xuống dưới như vậy mà phải chèn phía sau chữ ấy Các hãng thông tấn khác lấy về xóa sạch hình mờ rồi dùng mà,31
1699,Ghê tởm. Kim Soo Hyun điên rồi.,12
1700,Nếu là sự thật thì việc hẹn hò với trẻ vị thành niên có bị trừng phạt không? Mong là sẽ bị trừng phạt thích đáng theo pháp luật.,32
1701,"Nếu quan hệ tình dục ở tuổi 15 thì cấu thành tội hiếp dâm trẻ vị thành niên. Không cần biết có đồng ý hay không, có điều thời hiệu khởi tố có lẽ đã hết.",42
1702,"Này, nếu đây là Trung Quốc thì đã có án tử hình rồi đấy.",18
1703,Tại sao vậy? Bạn muốn hẹn hò với trẻ vị thành niên à? Ghê tởm,20
1704,Chắc phải bồi thường hợp đồng kinh khủng đây. Mấy trăm tỷ thế này thì dự là phá sản rồi.,23
1705,Nếu còn sống mà tung hê hết mọi chuyện... thì đã dùng dũng khí của người muốn chết để tổ chức họp báo và phỏng vấn rồi. Những bình luận ác ý và sự ghét bỏ bấy lâu nay chắc hẳn đã khiến người đó phải từ bỏ tất cả... Nếu đây là sự thật thì thật đáng tiếc. Mong là công ty quản lý không thể che đậy và mọi chuyện sẽ được phơi bày ra ánh sáng.,86
1706,"Ôi, có cả ảnh hôn mới nữa.",10
1707,"Liệu người đàn ông có cảm thấy tội lỗi chút nào không nhỉ, thấy thương người phụ nữ quá.",22
1708,Thế này thì là do nó giết rồi còn gì nữa,11
1709,"Chắc bố mẹ Saeron không biết con gái mình hẹn hò với người đàn ông trưởng thành hơn 6 tuổi để rồi bị ""tống khứ"" à? Thế là không quan tâm đến con gái rồi, đáng tiếc thật.",46
1710,"Nghe nói Kim Sae Ron kiếm được bao nhiêu tiền từ hoạt động giải trí đều đổ hết vào việc kinh doanh của gia đình, hoàn cảnh gia đình có vẻ cũng không tốt nữa. Thương Kim Sae Ron quá đi mất.",49
1711,Bây giờ quyết định đi theo hướng hài hước ạ?,12
1712,Nghe nói đám tang Won Bin đã khóc rất nhiều...,13
1713,"Không đến mức khóc ngất nhưng mà... hình như đã rơi nước mắt. 15 năm ở ẩn nhưng vẫn chạy ngay đến phúng viếng người đã khuất vì mối nhân duyên từ một tác phẩm. Một người đàn ông đúng là người lớn tốt bụng và rất trọng nghĩa khí, Se Ron.",58
1714,Trời đất ơi!! Nghệ sĩ cùng công ty... hơn nữa Kim Sae Ron do chính mình đưa về mà lại không đến tang lễ á?? Có phải là người không vậy.....,40
1715,"Nhớ lại Won Bin với vẻ mặt sốc tột độ tại tang lễ...... Ôi Sae Ron à, mong em an nghỉ ở một nơi tốt đẹp, được diễn xuất như mong muốn và hạnh phúc.",42
1716,Lần này tiền phạt vi phạm hợp đồng là bao nhiêu nhỉ.,14
1717,Vạch mặt hắn ngay bây giờ.,8
1718,"Những câu nói nổi tiếng của Kim Soo Hyun ""Tôi sẽ kết hôn với người 21 tuổi vào năm 41 tuổi"" Với Kim Yoo Jung 13 tuổi: ""Em trưởng thành hơn anh nghĩ. Anh muốn gặp em với tư cách là bạn diễn trong tương lai.""",55
1719,Ra là nhắm đến đối tượng dưới 20 tuổi... Đến khi thành niên là bị bỏ rơi luôn sao,21
1720,Khi nào thì bạn nói điều đó với Kim Yoo Jung?,12
1721,Kim Soo Hyun còn tệ hơn cả Go Young Wook nữa ㅡㅡ;;;,16
1722,Kim Sae Ron mất vào ngày sinh nhật của Kim Soo Hyun nhưng... nhìn cái cách mà G-Dragon mở tiệc ăn mừng chỉ một tuần sau khi Kim Sae Ron qua đời thì đủ biết Kim Soo Hyun là loại người không hề nghĩ đến Kim Sae Ron mỗi dịp sinh nhật... bọn thái nhân cách vốn dĩ là vậy mà Nếu Kim Soo Hyun đau lòng mỗi dịp sinh nhật vì cái chết của Kim Sae Ron thì đã chẳng yêu đương với trẻ 15 tuổi? Chắc cũng chẳng có chuyện gửi giấy báo nợ 700 triệu won?.... Kim Soo Hyun là loại người không biết đến tội lỗi là gì... Chỉ người chết là đáng thương thôi.,134
1723,"Có phải tất cả người thân cận của Kim Soo-hyun đều là tả phái thân Trung Quốc không? G-Dragon thì thuộc YG nên chắc chắn rồi, còn Jung Hae-in thì sao? Thật sự thất vọng về Kim Soo-hyun và đám người thân cận của anh ta, thật đáng ghê tởm và buồn nôn.",68
1724,"Có lẽ là do G-Dragon tham gia chương trình giải trí nên họ đã tụ tập. Những người sinh năm 1988 như Lee Soo Hyuk, Jung Hae In, Hwang Kwanghee, Im Siwan,... đã tụ tập và quay YouTube, nhưng không may là Gia đình của chúng ta lại bị vạ lây.",65
1725,Ghét nhất thằng nghiện ngập G-Dragon,7
1726,Nếu đây là sự thật thì Kim Soo Hyun nên bị đuổi khỏi giới giải trí và bị trừng phạt!!!!!!,27
1727,"Tôi nghi ngờ Kim Soo-hyun không phải là педофил đâu nhỉ Một diễn viên nổi tiếng từ Vì Sao Đưa Anh Tới và đang rất thành công ở độ tuổi cuối 20, tại sao lại hẹn hò với một học sinh cấp hai...? Xung quanh anh ta có rất nhiều cô gái xinh đẹp và thành đạt, tại sao anh ta lại hẹn hò với một đứa trẻ? Nếu không phải là педофил thì tôi không thể hiểu được;;",101
1728,ấu dâm i9g,5
1729,"Có lẽ vấn đề là ở công ty quản lý. Có vẻ như công ty quản lý xử lý mọi việc, nắm được điểm yếu của nữ diễn viên nên đã cắn chặt lấy.",39
1730,"Sao bố mẹ lại bỏ bê con bé tận 6 năm trời, đã vậy còn có nghĩa vụ bảo vệ con cái vị thành niên nữa chứ, tội nghiệp Se Ron quá.",38
1731,Hôm nay dì có vẻ lạ so với hôm qua.,11
1732,"Ok, tôi cần sub tiếng Anh.",7
1733,"Việc một học sinh trung học hẹn hò với một người lớn cũng là một điều đáng sợ, loại người đó còn tồi tệ hơn với một đứa trẻ.",31
1734,"Ôi, cái gì đây!",8
1735,"Wow, khuôn mặt ngây thơ và thông minh kia che giấu hai mặt của một diễn viên, đáng sợ thật. Nhiều tiền như vậy mà lại đối xử với trẻ con như thế... Nếu là từ khi còn nhỏ thì có lẽ đó là mối tình đầu, vết thương lòng lớn đến mức nào chứ...",64
1736,Hễ mà bị tiền làm mờ mắt thì ai cũng thành ra như thế thôi.,16
1737,Mọi người không ai biết GHS thời Cyworld à? Từ hồi đó đã thấy sai sai rồi....,23
1738,Tại sao ạ??,5
1739,"헐 100 vạn view điên rồi. Đúng là Gaseyeon, mình cùng đạt 1,5 triệu người đăng ký nào!!",27
1740,Cái này thật á????? Kim Soo Hyun thật sự làm vậy á????? Nếu là thật thì cái này đúng là.... chuyện lớn luôn đó....,36
1741,"Tôi thấy Kim Soo Hyun và Go Young Wook có vẻ giống nhau, đều là những kẻ ấu dâm.",22
1742,"Wow, thật tuyệt vời khi có rất nhiều thông tin về điều này.",16
1743,Nếu Kim Sae Ron đã quyết định chết thì nên tống tiền vài tỷ won bằng cách đe dọa sẽ vạch trần mọi thứ. Sao lại phải chết? Chắc hẳn phải uất ức lắm nên mới chọn ngày sinh nhật của Kim Soo Hyun để qua đời.,54
1744,Kim Soo Hyun hãy sụp đổ đi..,8
1745,"Bực thật, mong Sae Ron sống sót trở về.",14
1746,Có nhà giá 10 tỷ won một căn mà có tận 3 căn... chỉ vì 700 triệu won... mà một cô gái 25 tuổi đã chết,29
1747,Đây không phải là người.,6
1748,Tôi nhớ cảnh chú Won Bin báo thù.,9
1749,"Shin Madam Jang Geun Suk hdd Kim Soo-hyun nhóm máu AB poker face hai mặt lăng nhăng đáng sợ hdd đồ điên thái nhân cách Choi ㅁㅅ đang nợ nần mà cưới vợ ghê thật đàn ông nhóm máu AB dễ bị lừa lắm phụ nữ, đàn ông nhóm máu Bạn cẩn thận nha 100% ái kỷ với cả chống đối xã hội đấy",74
1750,"Thật đáng tiếc, Soo Hyun là người xấu, còn Sae Ron thì đáng thương, nhưng sao còn trẻ mà lại đi với người đàn ông trưởng thành. Bố mẹ Sae Ron không nói gì sao?",45
1751,Chắc chắn là đã can ngăn rồi. Và Kim Soo Hyun ở độ tuổi cuối 20 lẽ ra nên từ chối. Con nít cấp 2 mà nghe lời bố mẹ chắc? Nếu là một người đàn ông trưởng thành có đầu óc thì đã không hẹn hò.,55
1752,"Bố mẹ có ngăn cản thì ở cái tuổi đó cũng chẳng biết gì đâu... huống chi là nghe bạn bè nói thằng đó không tốt, đừng có gặp? Khi yêu rồi thì hết thuốc chữa... Người lớn phải tự kiềm chế thôi... Thằng dụ dỗ trẻ vị thành niên mới là thằng sai.",66
1753,Có khi nào 6 năm chỉ hẹn hò với Kim Sae-ron không?,16
1754,"Bắt cá hai tay, bắt cá ba tay?",10
1755,"Một lần dính scandal là bịгре luôn, kinh thật...",17
1756,Không có tiền giúp đỡ nhưng lại có tiền thuê cả đống luật sư đắt tiền?,18
1757,Thương Kim Sae Ron quá.. Không phải vì khó khăn kinh tế đâu.. Tại Kim Soo Hyun bảo trả ngay 700 triệu won nên mới nhận được thông báo đòi nợ đó... Một mình chịu đựng... Phải vạch trần chứ.. Đến vạch trần cũng không làm.. Kim Sae Ron hiền quá đi mất.. Buồn quá.,71
1758,"Kim Soo Hyun, đồ tồi. Tại sao bố mẹ của Kim Sae Ron lại không bảo vệ con gái vị thành niên của mình, lại để con bé qua lại với đàn ông trưởng thành? Sáu năm thì không thể không biết. Sae Ron cũng là một đứa trẻ táo tợn.",62
1759,Nếu mà diễn với cái mặt ngây thơ đó rồi nhờ vả thì có lẽ tôi đã tin đó.,20
1760,"Suhyun à, giải nghệ thôi.",8
1761,Giờ thì nó không sống được ở Hàn Quốc nữa rồi.,13
1762,"Buồn thật đấy, đáng bị trời phạt.",10
1763,Hóa ra là ông chú ấu dâm. Sống trong tội lỗi đi nhé ông chú...,19
1764,"Sốc quá, nhìn là thấy tính cách thường ngày thế nào rồi... Đến cả những người xung quanh cũng phát ghét theo. Ghê.",30
1765,Những đứa trẻ vị thành niên #metoo hãy ra đây nhanh lên.,15
1766,"Không đến đám tang đã rợn tóc gáy rồi, cho là trốn tránh vì bị đám phóng viên xông vào đi... Vậy mà 6 ngày sau lại mở tiệc tùng...",36
1767,Chắc là bữa tiệc đó có cả thành viên G-Dragon cùng tham gia chương trình nên tất cả các thành viên trong chương trình đó đều đến đấy.,29
1768,"Tôi là một trong những người đã không chỉ trích và rất tiếc cho Saeron khi vụ lái xe khi say xỉn xảy ra. Gần đây, khi tôi nghe tin quá đau lòng và không thể tin được, tôi đã rất đau lòng. Tôi nghĩ bạn đã lựa chọn cực đoan vì cuộc sống không phải là cuộc sống, bạn nghĩ rằng bạn phải chết để sống. Tôi rất tiếc và đau lòng. Tôi không có tôn giáo, nhưng tôi chân thành cầu nguyện và cầu nguyện rằng bạn sẽ hạnh phúc hơn bất kỳ ai khác ở đó.",112
1769,Wow... đồ cặn bã... Kim Soo Hyun,10
1770,Tôi ủng hộ Viện Nghiên cứu Dọc và Ngang. Đã đăng ký.,14
1771,"Sajunghyeong và Kim Soo-hyun, lũ côn đồ. Công ty quản lý cũng có vấn đề.",24
1772,Ủng hộ GaSeYeon không cần nhìn sắc mặt ai!,13
1773,Chắc phải mua mỹ phẩm Konishya thôi.,10
1774,Mỹ phẩm Konisha tuyệt vời.,8
1775,Khi phụ nữ mang hận thì tháng năm cũng có sương.,13
1776,"Công ty quản lý tàn nhẫn thật đấy, đấy là công ty quản lý hay là Kim So Hyun vậy, quá đáng với Kim Sae Ron. Ít nhất thì họ cũng quen biết nhau lâu rồi, đến lúc mất thì họ chỉ im lặng và không hề thấy buồn, bộ các người chưa từng say à? Uống rượu là chuyện bình thường ở đó, Sae Ron sai ở chỗ lái xe khi say xỉn, mà chắc chắn đó là trường hợp phổ biến ở đó, ai bảo cô ấy là nghệ sĩ làm gì.",113
1777,"Haha, đến cả người mẫu quảng cáo cơ đấy.",13
